date,SST,year,month,day,Total_Cal,Total_pseudCent
4/1/82,280.6740076,1982,4,1,1250,2500
4/2/82,280.619609,1982,4,2,1030,3000
4/3/82,280.6411168,1982,4,3,810,3500
4/4/82,280.8261012,1982,4,4,590,4000
4/5/82,280.8843889,1982,4,5,370,4500
4/6/82,280.9178516,1982,4,6,150,5000
4/7/82,281.1093663,1982,4,7,139,4444.4
4/8/82,281.1505552,1982,4,8,128,3888.9
4/9/82,281.1406384,1982,4,9,117,3333.3
4/10/82,281.152888,1982,4,10,106,2777.8
4/11/82,281.1487667,1982,4,11,94,2222.2
4/12/82,281.1501428,1982,4,12,83,1666.7
4/13/82,281.1790336,1982,4,13,72,1111.1
4/14/82,281.1937927,1982,4,14,61,555.6
4/15/82,281.352427,1982,4,15,50,0
4/16/82,281.7264304,1982,4,16,400,20000
4/17/82,281.8823091,1982,4,17,250,10000
4/18/82,281.755096,1982,4,18,100,0
4/19/82,281.9785518,1982,4,19,16650,10000
4/20/82,281.9890336,1982,4,20,13730,10500
4/21/82,281.8772485,1982,4,21,10810,11000
4/22/82,282.0501635,1982,4,22,7890,11500
4/23/82,282.0502294,1982,4,23,4970,12000
4/24/82,281.9956575,1982,4,24,2050,12500
4/25/82,281.9957649,1982,4,25,3975,13750
4/26/82,282.3124166,1982,4,26,5900,15000
4/27/82,282.4249365,1982,4,27,7825,16250
4/28/82,282.5822814,1982,4,28,9750,17500
4/29/82,282.5907944,1982,4,29,11675,18750
4/30/82,282.5597996,1982,4,30,13600,20000
5/1/82,282.4932866,1982,5,1,3000,12500
5/2/82,282.3878238,1982,5,2,2769,11730.8
5/3/82,282.3686453,1982,5,3,2538,10961.5
5/4/82,282.355245,1982,5,4,2308,10192.3
5/5/82,282.337498,1982,5,5,2077,9423.1
5/6/82,282.0164304,1982,5,6,1846,8653.8
5/7/82,282.0790336,1982,5,7,1615,7884.6
5/8/82,282.0232485,1982,5,8,1385,7115.4
5/9/82,281.8774183,1982,5,9,1154,6346.2
5/10/82,282.1820041,1982,5,10,923,5576.9
5/11/82,282.2079556,1982,5,11,692,4807.7
5/12/82,282.14407,1982,5,12,462,4038.5
5/13/82,282.1923195,1982,5,13,231,3269.2
5/14/82,282.2188914,1982,5,14,0,2500
5/15/82,282.3731583,1982,5,15,1750,55000
5/16/82,282.4026523,1982,5,16,350,0
5/17/82,282.4259209,1982,5,17,14400,5000
5/18/82,282.4156401,1982,5,18,11580,4000
5/19/82,283.1958412,1982,5,19,8760,3000
5/20/82,283.3937614,1982,5,20,5940,2000
5/21/82,283.4165795,1982,5,21,3120,1000
5/22/82,283.4582086,1982,5,22,300,0
5/23/82,283.6793178,1982,5,23,233,5000
5/24/82,283.757602,1982,5,24,167,10000
5/25/82,283.4496678,1982,5,25,100,15000
5/26/82,283.4302363,1982,5,26,12525,51250
5/27/82,283.4708082,1982,5,27,24950,87500
5/28/82,283.4809053,1982,5,28,13500,46250
5/29/82,283.4834287,1982,5,29,2050,5000
5/30/82,283.4841739,1982,5,30,14050,87500
5/31/82,283.4841184,1982,5,31,12294,76562.5
6/1/82,283.6414148,1982,6,1,10538,65625
6/2/82,284.3726938,1982,6,2,8781,54687.5
6/3/82,284.5659243,1982,6,3,7025,43750
6/4/82,284.9838273,1982,6,4,5269,32812.5
6/5/82,285.7603818,1982,6,5,3513,21875
6/6/82,285.921699,1982,6,6,1756,10937.5
6/7/82,286.108874,1982,6,7,0,0
6/8/82,286.1694044,1982,6,8,2600,10000
6/9/82,286.4361946,1982,6,9,5200,20000
6/10/82,286.5571062,1982,6,10,1900,97500
6/11/82,286.5797163,1982,6,11,3150,20000
6/12/82,286.5973385,1982,6,12,1775,18750
6/13/82,285.6745517,1982,6,13,400,17500
6/14/82,285.5309018,1982,6,14,1500,12500
6/15/82,285.5126765,1982,6,15,2600,7500
6/16/82,285.4244893,1982,6,16,3250,12500
6/17/82,285.4132137,1982,6,17,3900,17500
6/18/82,285.4306938,1982,6,18,4550,22500
6/19/82,285.4549156,1982,6,19,5200,27500
6/20/82,284.8907111,1982,6,20,3300,15000
6/21/82,284.8500838,1982,6,21,3931,48437.5
6/22/82,285.1137302,1982,6,22,4563,81875
6/23/82,285.125855,1982,6,23,5194,115312.5
6/24/82,285.1659,1982,6,24,5825,148750
6/25/82,285.1996054,1982,6,25,6456,182187.5
6/26/82,285.2607181,1982,6,26,7088,215625
6/27/82,285.2967077,1982,6,27,7719,249062.5
6/28/82,285.281342,1982,6,28,8350,282500
6/29/82,285.0631513,1982,6,29,7515,254250
6/30/82,285.0423714,1982,6,30,6680,226000
7/1/82,285.1613212,1982,7,1,5845,197750
7/2/82,285.1746002,1982,7,2,5010,169500
7/3/82,285.2317961,1982,7,3,4175,141250
7/4/82,285.3010231,1982,7,4,3340,113000
7/5/82,285.3275014,1982,7,5,2505,84750
7/6/82,285.9707562,1982,7,6,1670,56500
7/7/82,286.1873662,1982,7,7,835,28250
7/8/82,286.2550369,1982,7,8,0,0
7/9/82,286.2522605,1982,7,9,4100,67500
7/10/82,286.2234425,1982,7,10,3875,40000
7/11/82,286.7490854,1982,7,11,3650,12500
7/12/82,286.8048636,1982,7,12,2467,13333.3
7/13/82,286.6770127,1982,7,13,1283,14166.7
7/14/82,286.648666,1982,7,14,100,15000
7/15/82,286.484361,1982,7,15,200,15000
7/16/82,286.4562016,1982,7,16,271,17142.9
7/17/82,286.4458272,1982,7,17,343,19285.7
7/18/82,286.9277891,1982,7,18,414,21428.6
7/19/82,287.0098203,1982,7,19,486,23571.4
7/20/82,287.0211686,1982,7,20,557,25714.3
7/21/82,287.0056539,1982,7,21,629,27857.1
7/22/82,286.7234009,1982,7,22,700,30000
7/23/82,286.8153038,1982,7,23,2925,42500
7/24/82,287.0086106,1982,7,24,5150,55000
7/25/82,287.2942778,1982,7,25,7250,17500
7/26/82,287.3443853,1982,7,26,6715,16153.8
7/27/82,287.9241877,1982,7,27,6181,14807.7
7/28/82,287.9338653,1982,7,28,5646,13461.5
7/29/82,287.8609398,1982,7,29,5112,12115.4
7/30/82,288.201023,1982,7,30,4577,10769.2
7/31/82,288.2765204,1982,7,31,4042,9423.1
8/1/82,288.1623229,1982,8,1,3508,8076.9
8/2/82,288.1754563,1982,8,2,2973,6730.8
8/3/82,288.2170542,1982,8,3,2438,5384.6
8/4/82,288.2963506,1982,8,4,1904,4038.5
8/5/82,288.3255603,1982,8,5,1369,2692.3
8/6/82,288.1246348,1982,8,6,835,1346.2
8/7/82,287.9954667,1982,8,7,300,0
8/8/82,287.91764,1982,8,8,1625,16250
8/9/82,287.9626833,1982,8,9,2950,32500
8/10/82,287.9724684,1982,8,10,6400,30000
8/11/82,288.0686105,1982,8,11,4367,22500
8/12/82,287.9464199,1982,8,12,2333,15000
8/13/82,287.722153,1982,8,13,300,7500
8/14/82,287.8722847,1982,8,14,6950,22500
8/15/82,287.8915152,1982,8,15,4733,15000
8/16/82,287.8259693,1982,8,16,2517,7500
8/17/82,287.7281634,1982,8,17,300,0
8/18/82,287.2610993,1982,8,18,9483,37500
8/19/82,287.0779208,1982,8,19,18667,75000
8/20/82,287.0452865,1982,8,20,27850,112500
8/21/82,287.0199381,1982,8,21,5200,37500
8/22/82,287.0025204,1982,8,22,0,0
8/23/82,286.9851998,1982,8,23,4100,132500
8/24/82,286.967543,1982,8,24,4600,115000
8/25/82,286.8572553,1982,8,25,3625,86250
8/26/82,286.8885309,1982,8,26,2650,57500
8/27/82,287.0101288,1982,8,27,1675,28750
8/28/82,287.0717787,1982,8,28,700,0
8/29/82,287.0691686,1982,8,29,820,4500
8/30/82,287.0267388,1982,8,30,940,9000
8/31/82,286.9446556,1982,8,31,1060,13500
9/1/82,286.8702016,1982,9,1,1180,18000
9/2/82,286.8986036,1982,9,2,1300,22500
9/3/82,286.8191444,1982,9,3,1420,27000
9/4/82,286.8375672,1982,9,4,1540,31500
9/5/82,286.8317059,1982,9,5,1660,36000
9/6/82,286.8122189,1982,9,6,1780,40500
9/7/82,286.6843679,1982,9,7,1900,45000
9/8/82,286.6554459,1982,9,8,16800,40000
9/9/82,286.6994979,1982,9,9,8700,31250
9/10/82,286.6467908,1982,9,10,600,22500
9/11/82,286.6028497,1982,9,11,1850,25000
9/12/82,286.4632241,1982,9,12,2386,23571.4
9/13/82,286.4506314,1982,9,13,2921,22142.9
9/14/82,286.4392865,1982,9,14,3457,20714.3
9/15/82,286.4623298,1982,9,15,3993,19285.7
9/16/82,286.5122813,1982,9,16,4529,17857.1
9/17/82,286.5120491,1982,9,17,5064,16428.6
9/18/82,286.461803,1982,9,18,5600,15000
9/19/82,286.4401565,1982,9,19,450,167500
9/20/82,286.3872449,1982,9,20,500,47500
9/21/82,286.2482536,1982,9,21,2350,7500
9/22/82,286.2021184,1982,9,22,0,0
9/23/82,286.0720907,1982,9,23,170,1500
9/24/82,286.1130265,1982,9,24,340,3000
9/25/82,286.0904338,1982,9,25,510,4500
9/26/82,286.0741184,1982,9,26,680,6000
9/27/82,286.0611583,1982,9,27,850,7500
9/28/82,286.0567215,1982,9,28,1020,9000
9/29/82,286.0591063,1982,9,29,1190,10500
9/30/82,286.050205,1982,9,30,1360,12000
10/1/82,286.075238,1982,10,1,1530,13500
10/2/82,285.9803541,1982,10,2,1700,15000
10/3/82,285.9405343,1982,10,3,2300,12500
10/4/82,285.7012692,1982,10,4,5394,13437.5
10/5/82,286.4050924,1982,10,5,8488,14375
10/6/82,286.2162224,1982,10,6,11581,15312.5
10/7/82,286.2086695,1982,10,7,14675,16250
10/8/82,286.2229676,1982,10,8,17769,17187.5
10/9/82,285.7101357,1982,10,9,20863,18125
10/10/82,285.6510023,1982,10,10,23956,19062.5
10/11/82,285.5967735,1982,10,11,27050,20000
10/12/82,285.3342328,1982,10,12,18067,13333.3
10/13/82,285.2335084,1982,10,13,9083,6666.7
10/14/82,285.3770231,1982,10,14,100,0
10/15/82,285.4460699,1982,10,15,1450,10000
10/16/82,285.5016054,1982,10,16,1300,8888.9
10/17/82,285.481446,1982,10,17,1150,7777.8
10/18/82,285.4615188,1982,10,18,1000,6666.7
10/19/82,285.37103,1982,10,19,850,5555.6
10/20/82,285.1840768,1982,10,20,700,4444.4
10/21/82,285.0617683,1982,10,21,550,3333.3
10/22/82,284.9393662,1982,10,22,400,2222.2
10/23/82,285.0694876,1982,10,23,250,1111.1
10/24/82,285.0929815,1982,10,24,100,0
10/25/82,285.0197025,1982,10,25,143,0
10/26/82,285.187595,1982,10,26,186,0
10/27/82,285.2313593,1982,10,27,229,0
10/28/82,285.2446626,1982,10,28,271,0
10/29/82,285.2359798,1982,10,29,314,0
10/30/82,285.2272311,1982,10,30,357,0
10/31/82,285.2197094,1982,10,31,400,0
4/1/83,280.5773733,1983,4,1,367,0
4/2/83,280.5402849,1983,4,2,333,0
4/3/83,280.5464374,1983,4,3,300,0
4/4/83,280.374784,1983,4,4,6600,0
4/5/83,280.8735431,1983,4,5,3600,2500
4/6/83,280.8265449,1983,4,6,600,5000
4/7/83,280.6905483,1983,4,7,500,2500
4/8/83,280.6505899,1983,4,8,459,2272.7
4/9/83,280.6308152,1983,4,9,418,2045.5
4/10/83,280.5586072,1983,4,10,377,1818.2
4/11/83,280.4226592,1983,4,11,336,1590.9
4/12/83,280.3634357,1983,4,12,295,1363.6
4/13/83,280.3752242,1983,4,13,255,1136.4
4/14/83,280.4662052,1983,4,14,214,909.1
4/15/83,280.4816887,1983,4,15,173,681.8
4/16/83,280.4869019,1983,4,16,132,454.5
4/17/83,280.4752762,1983,4,17,91,227.3
4/18/83,280.926427,1983,4,18,50,0
4/19/83,280.9711272,1983,4,19,12450,57500
4/20/83,280.9826592,1983,4,20,450,0
4/21/83,280.9948533,1983,4,21,533,0
4/22/83,280.9920007,1983,4,22,617,0
4/23/83,280.9629539,1983,4,23,700,0
4/24/83,280.8844131,1983,4,24,980,500
4/25/83,280.8561948,1983,4,25,1260,1000
4/26/83,280.805602,1983,4,26,1540,1500
4/27/83,280.7925414,1983,4,27,1820,2000
4/28/83,280.7979175,1983,4,28,2100,2500
4/29/83,280.5531549,1983,4,29,3800,0
4/30/83,280.469349,1983,4,30,41400,57500
5/1/83,280.4181601,1983,5,1,5550,20000
5/2/83,280.886635,1983,5,2,4856,17500
5/3/83,281.4622086,1983,5,3,4163,15000
5/4/83,281.535349,1983,5,4,3469,12500
5/5/83,281.232122,1983,5,5,2775,10000
5/6/83,281.2911896,1983,5,6,2081,7500
5/7/83,281.2971688,1983,5,7,1388,5000
5/8/83,282.0513213,1983,5,8,694,2500
5/9/83,282.1683368,1983,5,9,0,0
5/10/83,282.1072346,1983,5,10,75,1250
5/11/83,281.9875362,1983,5,11,150,2500
5/12/83,281.6543923,1983,5,12,450,0
5/13/83,281.5021566,1983,5,13,675,1250
5/14/83,281.4875535,1983,5,14,900,2500
5/15/83,281.6992658,1983,5,15,817,52500
5/16/83,281.7587979,1983,5,16,733,102500
5/17/83,281.8208291,1983,5,17,650,152500
5/18/83,281.5425171,1983,5,18,1413,115625
5/19/83,281.4607632,1983,5,19,2175,78750
5/20/83,281.4668429,1983,5,20,2938,41875
5/21/83,281.4829573,1983,5,21,3700,5000
5/22/83,281.8950336,1983,5,22,4208,23750
5/23/83,281.954583,1983,5,23,4717,42500
5/24/83,281.9679174,1983,5,24,5225,61250
5/25/83,282.373394,1983,5,25,5733,80000
5/26/83,282.3695258,1983,5,26,6242,98750
5/27/83,282.3568602,1983,5,27,6750,117500
5/28/83,282.2421947,1983,5,28,1250,40000
5/29/83,282.2868325,1983,5,29,4900,101250
5/30/83,282.1045656,1983,5,30,8550,162500
5/31/83,282.0911063,1983,5,31,6700,123333.3
6/1/83,282.1166696,1983,6,1,4850,84166.7
6/2/83,282.1312658,1983,6,2,3000,45000
6/3/83,282.1499452,1983,6,3,3217,37916.7
6/4/83,282.1670855,1983,6,4,3433,30833.3
6/5/83,282.9357233,1983,6,5,3650,23750
6/6/83,282.9784963,1983,6,6,3867,16666.7
6/7/83,282.9359174,1983,6,7,4083,9583.3
6/8/83,282.9460595,1983,6,8,4300,2500
6/9/83,282.9585795,1983,6,9,2150,1250
6/10/83,282.9688498,1983,6,10,0,0
6/11/83,283.4345483,1983,6,11,200,0
6/12/83,283.30955,1983,6,12,400,0
6/13/83,283.1048498,1983,6,13,600,0
6/14/83,283.0612796,1983,6,14,4233,5000
6/15/83,283.3380595,1983,6,15,7867,10000
6/16/83,283.3959209,1983,6,16,11500,15000
6/17/83,283.831037,1983,6,17,0,0
6/18/83,283.9131098,1983,6,18,8100,0
6/19/83,284.8801704,1983,6,19,2300,0
6/20/83,285.112361,1983,6,20,3188,26250
6/21/83,284.9170578,1983,6,21,4075,52500
6/22/83,284.9230786,1983,6,22,4963,78750
6/23/83,284.8661496,1983,6,23,5850,105000
6/24/83,284.9025725,1983,6,24,5318,95681.8
6/25/83,284.9430682,1983,6,25,4786,86363.6
6/26/83,284.9658619,1983,6,26,4255,77045.5
6/27/83,284.8144754,1983,6,27,3723,67727.3
6/28/83,284.7380422,1983,6,28,3191,58409.1
6/29/83,284.7470023,1983,6,29,2659,49090.9
6/30/83,284.9901947,1983,6,30,2127,39772.7
7/1/83,285.0286834,1983,7,1,1595,30454.5
7/2/83,284.5570959,1983,7,2,1064,21136.4
7/3/83,284.5928463,1983,7,3,532,11818.2
7/4/83,284.7975465,1983,7,4,0,2500
7/5/83,284.9576089,1983,7,5,19,3125
7/6/83,285.5184165,1983,7,6,38,3750
7/7/83,286.1505933,1983,7,7,56,4375
7/8/83,286.4462501,1983,7,8,75,5000
7/9/83,286.7714043,1983,7,9,94,5625
7/10/83,286.8986626,1983,7,10,113,6250
7/11/83,286.9358723,1983,7,11,131,6875
7/12/83,287.381439,1983,7,12,150,7500
7/13/83,287.5140005,1983,7,13,225,3750
7/14/83,287.4637648,1983,7,14,300,0
7/15/83,287.4495187,1983,7,15,1550,25000
7/16/83,287.2306487,1983,7,16,850,2500
7/17/83,287.5259728,1983,7,17,700,2000
7/18/83,287.8226799,1983,7,18,550,1500
7/19/83,287.7991478,1983,7,19,400,1000
7/20/83,286.6065135,1983,7,20,250,500
7/21/83,287.3703437,1983,7,21,100,0
7/22/83,287.7851894,1983,7,22,11450,72500
7/23/83,287.8970196,1983,7,23,2600,2500
7/24/83,287.6839658,1983,7,24,5650,38750
7/25/83,287.7776192,1983,7,25,8700,75000
7/26/83,287.8054563,1983,7,26,7979,68750
7/27/83,287.8211963,1983,7,27,7258,62500
7/28/83,287.8289676,1983,7,28,6538,56250
7/29/83,287.8326764,1983,7,29,5817,50000
7/30/83,287.8335499,1983,7,30,5096,43750
7/31/83,287.8323229,1983,7,31,4375,37500
8/1/83,287.8295776,1983,8,1,3654,31250
8/2/83,287.8257579,1983,8,2,2933,25000
8/3/83,287.820874,1983,8,3,2213,18750
8/4/83,287.5274043,1983,8,4,1492,12500
8/5/83,287.4120525,1983,8,5,771,6250
8/6/83,287.3510196,1983,8,6,50,0
8/7/83,287.4073662,1983,8,7,25,0
8/8/83,287.5513315,1983,8,8,0,0
8/9/83,287.5607804,1983,8,9,300,0
8/10/83,287.5528948,1983,8,10,271,714.3
8/11/83,287.3763021,1983,8,11,243,1428.6
8/12/83,287.1128567,1983,8,12,214,2142.9
8/13/83,287.527997,1983,8,13,186,2857.1
8/14/83,287.4890126,1983,8,14,157,3571.4
8/15/83,287.4681842,1983,8,15,129,4285.7
8/16/83,287.8020317,1983,8,16,100,5000
8/17/83,287.8704927,1983,8,17,1450,5000
8/18/83,287.8218411,1983,8,18,800,17500
8/19/83,288.0555811,1983,8,19,150,30000
8/20/83,288.11077,1983,8,20,3500,62500
8/21/83,288.8573107,1983,8,21,0,0
8/22/83,288.9948185,1983,8,22,358,2500
8/23/83,288.956614,1983,8,23,717,5000
8/24/83,288.9230854,1983,8,24,1075,7500
8/25/83,288.5019936,1983,8,25,1433,10000
8/26/83,288.5982778,1983,8,26,1792,12500
8/27/83,288.7581877,1983,8,27,2150,15000
8/28/83,288.7364857,1983,8,28,37850,67500
8/29/83,288.704926,1983,8,29,33817,70833.3
8/30/83,288.705335,1983,8,30,29783,74166.7
8/31/83,288.7758202,1983,8,31,25750,77500
9/1/83,288.8352136,1983,9,1,21717,80833.3
9/2/83,288.8066279,1983,9,2,17683,84166.7
9/3/83,288.7796019,1983,9,3,13650,87500
9/4/83,288.6950091,1983,9,4,9617,90833.3
9/5/83,287.8824615,1983,9,5,5583,94166.7
9/6/83,287.6012587,1983,9,6,1550,97500
9/7/83,287.5844719,1983,9,7,1292,81250
9/8/83,287.5650404,1983,9,8,1033,65000
9/9/83,287.3712033,1983,9,9,775,48750
9/10/83,287.1035395,1983,9,10,517,32500
9/11/83,286.9309087,1983,9,11,258,16250
9/12/83,286.8950646,1983,9,12,0,0
9/13/83,286.8648636,1983,9,13,2450,7500
9/14/83,286.8448532,1983,9,14,1700,2500
9/15/83,286.8252934,1983,9,15,9675,145000
9/16/83,286.7849191,1983,9,16,17650,287500
9/17/83,286.7482848,1983,9,17,1200,57500
9/18/83,286.5102154,1983,9,18,1900,42500
9/19/83,286.4100075,1983,9,19,2600,27500
9/20/83,286.3820144,1983,9,20,2388,25208.3
9/21/83,286.3573939,1983,9,21,2175,22916.7
9/22/83,286.3360664,1983,9,22,1963,20625
9/23/83,286.3175777,1983,9,23,1750,18333.3
9/24/83,286.3012241,1983,9,24,1538,16041.7
9/25/83,286.2867284,1983,9,25,1325,13750
9/26/83,286.2736504,1983,9,26,1113,11458.3
9/27/83,286.2634702,1983,9,27,900,9166.7
9/28/83,285.9892588,1983,9,28,688,6875
9/29/83,285.9070681,1983,9,29,475,4583.3
9/30/83,285.9128706,1983,9,30,263,2291.7
10/1/83,285.8705759,1983,10,1,50,0
10/2/83,285.8638862,1983,10,2,300,15000
10/3/83,285.7337406,1983,10,3,688,31250
10/4/83,285.6037198,1983,10,4,1075,47500
10/5/83,285.7433593,1983,10,5,1463,63750
10/6/83,285.8148047,1983,10,6,1850,80000
10/7/83,285.7945205,1983,10,7,1425,60000
10/8/83,285.7951409,1983,10,8,1000,40000
10/9/83,285.851907,1983,10,9,575,20000
10/10/83,285.8844304,1983,10,10,150,0
10/11/83,285.8754217,1983,10,11,113,0
10/12/83,285.8335985,1983,10,12,75,0
10/13/83,285.7103472,1983,10,13,38,0
10/14/83,285.6713628,1983,10,14,0,0
10/15/83,285.5352415,1983,10,15,150,2500
10/16/83,285.5189468,1983,10,16,283,48333.3
10/17/83,285.5037059,1983,10,17,417,94166.7
10/18/83,285.4259728,1983,10,18,550,140000
10/19/83,285.2495881,1983,10,19,1700,97500
10/20/83,285.1872449,1983,10,20,2400,51250
10/21/83,285.057491,1983,10,21,3100,5000
10/22/83,285.0449746,1983,10,22,0,0
10/23/83,285.034056,1983,10,23,150,0
10/24/83,285.0695881,1983,10,24,150,0
10/25/83,285.0460144,1983,10,25,150,0
10/26/83,285.017394,1983,10,26,236,0
10/27/83,284.7071964,1983,10,27,321,0
10/28/83,284.7012241,1983,10,28,407,0
10/29/83,284.7381981,1983,10,29,493,0
10/30/83,284.7311513,1983,10,30,579,0
10/31/83,284.7148325,1983,10,31,664,0
4/1/84,280.5810648,1984,4,1,750,0
4/2/84,280.5739833,1984,4,2,1300,0
4/3/84,280.3397372,1984,4,3,1850,0
4/4/84,280.3863126,1984,4,4,2400,0
4/5/84,280.5682052,1984,4,5,2000,0
4/6/84,280.7433386,1984,4,6,1300,0
4/7/84,280.8358447,1984,4,7,600,0
4/8/84,280.8804547,1984,4,8,533,0
4/9/84,280.8551896,1984,4,9,467,0
4/10/84,280.8733351,1984,4,10,400,0
4/11/84,280.8644547,1984,4,11,333,0
4/12/84,280.8583057,1984,4,12,267,0
4/13/84,280.9974461,1984,4,13,200,0
4/14/84,281.0452138,1984,4,14,133,0
4/15/84,280.9340041,1984,4,15,67,0
4/16/84,280.884888,1984,4,16,0,0
4/17/84,280.9007598,1984,4,17,200,0
4/18/84,280.8963369,1984,4,18,188,0
4/19/84,280.8924339,1984,4,19,175,0
4/20/84,280.8886488,1984,4,20,163,0
4/21/84,281.5881116,1984,4,21,150,0
4/22/84,281.6299694,1984,4,22,138,0
4/23/84,281.8036332,1984,4,23,125,0
4/24/84,281.8382571,1984,4,24,113,0
4/25/84,281.9069989,1984,4,25,100,0
4/26/84,282.1403542,1984,4,26,88,0
4/27/84,282.2221462,1984,4,27,75,0
4/28/84,282.2168325,1984,4,28,63,0
4/29/84,281.9881427,1984,4,29,50,0
4/30/84,281.952427,1984,4,30,11100,195000
5/1/84,281.9388672,1984,5,1,10561,184736.8
5/2/84,282.5760491,1984,5,2,10021,174473.7
5/3/84,282.6324478,1984,5,3,9482,164210.5
5/4/84,282.5669469,1984,5,4,8942,153947.4
5/5/84,282.6058065,1984,5,5,8403,143684.2
5/6/84,282.7518446,1984,5,6,7863,133421.1
5/7/84,282.4845483,1984,5,7,7324,123157.9
5/8/84,282.6283264,1984,5,8,6784,112894.7
5/9/84,283.0711964,1984,5,9,6245,102631.6
5/10/84,283.0348602,1984,5,10,5705,92368.4
5/11/84,282.8462467,1984,5,11,5166,82105.3
5/12/84,282.8640179,1984,5,12,4626,71842.1
5/13/84,282.8555881,1984,5,13,4087,61578.9
5/14/84,282.871803,1984,5,14,3547,51315.8
5/15/84,283.2504651,1984,5,15,3008,41052.6
5/16/84,283.3153836,1984,5,16,2468,30789.5
5/17/84,283.4683299,1984,5,17,1929,20526.3
5/18/84,283.2883334,1984,5,18,1389,10263.2
5/19/84,283.3839347,1984,5,19,850,0
5/20/84,283.6261427,1984,5,20,1700,15000
5/21/84,283.6238619,1984,5,21,7883,78333.3
5/22/84,283.4889365,1984,5,22,14067,141666.7
5/23/84,283.2052554,1984,5,23,20250,205000
5/24/84,283.2602814,1984,5,24,17200,102500
5/25/84,283.3713732,1984,5,25,25650,251250
5/26/84,283.1439036,1984,5,26,34100,400000
5/27/84,283.3589399,1984,5,27,10000,107500
5/28/84,283.471706,1984,5,28,9080,98500
5/29/84,283.5150647,1984,5,29,8160,89500
5/30/84,283.5323507,1984,5,30,7240,80500
5/31/84,283.5792727,1984,5,31,6320,71500
6/1/84,283.4720214,1984,6,1,5400,62500
6/2/84,284.1110231,1984,6,2,4480,53500
6/3/84,284.0007077,1984,6,3,3560,44500
6/4/84,283.6523091,1984,6,4,2640,35500
6/5/84,283.6499833,1984,6,5,1720,26500
6/6/84,283.7211098,1984,6,6,800,17500
6/7/84,284.0003611,1984,6,7,0,5000
6/8/84,284.2359105,1984,6,8,100,0
6/9/84,284.5229261,1984,6,9,5394,15000
6/10/84,284.2284408,1984,6,10,10688,30000
6/11/84,284.2831236,1984,6,11,15981,45000
6/12/84,284.3118966,1984,6,12,21275,60000
6/13/84,284.3565066,1984,6,13,26569,75000
6/14/84,284.3492969,1984,6,14,31863,90000
6/15/84,284.3462952,1984,6,15,37156,105000
6/16/84,284.4608671,1984,6,16,42450,120000
6/17/84,284.50442,1984,6,17,33213,97500
6/18/84,284.5039486,1984,6,18,23975,75000
6/19/84,284.4979832,1984,6,19,14738,52500
6/20/84,284.5573524,1984,6,20,5500,30000
6/21/84,284.5798793,1984,6,21,3800,87500
6/22/84,284.7490543,1984,6,22,9600,115000
6/23/84,284.8062987,1984,6,23,11750,160000
6/24/84,284.7932068,1984,6,24,8100,166250
6/25/84,284.7835569,1984,6,25,4450,172500
6/26/84,284.7749018,1984,6,26,1450,30000
6/27/84,284.7681739,1984,6,27,650,52500
6/28/84,284.7480318,1984,6,28,591,47727.3
6/29/84,285.2230959,1984,6,29,532,42954.5
6/30/84,285.3072345,1984,6,30,473,38181.8
7/1/84,285.3445205,1984,7,1,414,33409.1
7/2/84,285.636361,1984,7,2,355,28636.4
7/3/84,285.6746522,1984,7,3,295,23863.6
7/4/84,285.4937891,1984,7,4,236,19090.9
7/5/84,286.3260595,1984,7,5,177,14318.2
7/6/84,286.4870508,1984,7,6,118,9545.5
7/7/84,286.7340976,1984,7,7,59,4772.7
7/8/84,286.219751,1984,7,8,0,0
7/9/84,286.1725031,1984,7,9,50,0
7/10/84,286.2181323,1984,7,10,100,0
7/11/84,286.2201877,1984,7,11,150,0
7/12/84,286.3047076,1984,7,12,200,0
7/13/84,286.3474425,1984,7,13,650,12500
7/14/84,286.5684997,1984,7,14,1100,25000
7/15/84,286.6185586,1984,7,15,600,15000
7/16/84,286.5934841,1984,7,16,400,12500
7/17/84,286.5950508,1984,7,17,200,10000
7/18/84,286.6494494,1984,7,18,0,7500
7/19/84,286.697238,1984,7,19,850,27500
7/20/84,286.6802154,1984,7,20,1000,52500
7/21/84,286.687075,1984,7,21,2325,73750
7/22/84,286.687952,1984,7,22,3650,95000
7/23/84,286.6939659,1984,7,23,850,5000
7/24/84,287.1180005,1984,7,24,831,4861.1
7/25/84,287.1255846,1984,7,25,811,4722.2
7/26/84,287.0501461,1984,7,26,792,4583.3
7/27/84,287.121848,1984,7,27,772,4444.4
7/28/84,287.1443957,1984,7,28,753,4305.6
7/29/84,287.156153,1984,7,29,733,4166.7
7/30/84,287.1632761,1984,7,30,714,4027.8
7/31/84,287.2128671,1984,7,31,694,3888.9
8/1/84,287.4082327,1984,8,1,675,3750
8/2/84,287.5367873,1984,8,2,656,3611.1
8/3/84,287.2417267,1984,8,3,636,3472.2
8/4/84,287.1128463,1984,8,4,617,3333.3
8/5/84,287.1518965,1984,8,5,597,3194.4
8/6/84,286.9254217,1984,8,6,578,3055.6
8/7/84,287.1139659,1984,8,7,558,2916.7
8/8/84,287.1327076,1984,8,8,539,2777.8
8/9/84,287.1574182,1984,8,9,519,2638.9
8/10/84,287.2543506,1984,8,10,500,2500
8/11/84,287.2798723,1984,8,11,388,1875
8/12/84,287.3188844,1984,8,12,275,1250
8/13/84,287.1314979,1984,8,13,163,625
8/14/84,287.5250542,1984,8,14,50,0
8/15/84,287.6447943,1984,8,15,425,10625
8/16/84,287.7081703,1984,8,16,800,21250
8/17/84,287.6721634,1984,8,17,1175,31875
8/18/84,287.7317613,1984,8,18,1550,42500
8/19/84,288.220354,1984,8,19,0,0
8/20/84,288.3935984,1984,8,20,2550,62500
8/21/84,288.4818202,1984,8,21,12700,130000
8/22/84,288.631387,1984,8,22,7050,81250
8/23/84,288.7070993,1984,8,23,1400,32500
8/24/84,288.7254216,1984,8,24,1321,30178.6
8/25/84,288.7029156,1984,8,25,1243,27857.1
8/26/84,288.6831513,1984,8,26,1164,25535.7
8/27/84,288.6979485,1984,8,27,1086,23214.3
8/28/84,288.6606729,1984,8,28,1007,20892.9
8/29/84,288.6340975,1984,8,29,929,18571.4
8/30/84,288.6215429,1984,8,30,850,16250
8/31/84,288.624049,1984,8,31,771,13928.6
9/1/84,288.6224788,1984,9,1,693,11607.1
9/2/84,288.6196192,1984,9,2,614,9285.7
9/3/84,288.2663644,1984,9,3,536,6964.3
9/4/84,288.1307596,1984,9,4,457,4642.9
9/5/84,288.0418549,1984,9,5,379,2321.4
9/6/84,287.8529086,1984,9,6,300,0
9/7/84,287.8187076,1984,9,7,13250,47500
9/8/84,287.8169953,1984,9,8,6625,23750
9/9/84,287.80564,1984,9,9,0,0
9/10/84,287.7970577,1984,9,10,38,7187.5
9/11/84,287.7913523,1984,9,11,75,14375
9/12/84,287.785231,1984,9,12,113,21562.5
9/13/84,287.5319728,1984,9,13,150,28750
9/14/84,287.4081045,1984,9,14,188,35937.5
9/15/84,287.6614875,1984,9,15,225,43125
9/16/84,287.7144199,1984,9,16,263,50312.5
9/17/84,287.554309,1984,9,17,300,57500
9/18/84,287.4378653,1984,9,18,3800,137500
9/19/84,287.338056,1984,9,19,1925,71250
9/20/84,287.2437163,1984,9,20,50,5000
9/21/84,287.201283,1984,9,21,150,5000
9/22/84,287.176413,1984,9,22,1175,36250
9/23/84,287.1440802,1984,9,23,2200,67500
9/24/84,286.7751028,1984,9,24,2068,62678.6
9/25/84,286.180874,1984,9,25,1936,57857.1
9/26/84,286.1949156,1984,9,26,1804,53035.7
9/27/84,286.1826834,1984,9,27,1671,48214.3
9/28/84,286.5349607,1984,9,28,1539,43392.9
9/29/84,286.5351894,1984,9,29,1407,38571.4
9/30/84,286.3814078,1984,9,30,1275,33750
10/1/84,286.3682917,1984,10,1,1143,28928.6
10/2/84,286.3645655,1984,10,2,1011,24107.1
10/3/84,286.253186,1984,10,3,879,19285.7
10/4/84,286.206309,1984,10,4,746,14464.3
10/5/84,286.1224615,1984,10,5,614,9642.9
10/6/84,286.032881,1984,10,6,482,4821.4
10/7/84,285.8330473,1984,10,7,350,0
10/8/84,285.7216227,1984,10,8,2000,8750
10/9/84,286.321283,1984,10,9,3650,17500
10/10/84,286.4692206,1984,10,10,5300,26250
10/11/84,286.3364407,1984,10,11,6950,35000
10/12/84,286.2490577,1984,10,12,8600,43750
10/13/84,286.1913454,1984,10,13,10250,52500
10/14/84,286.1457822,1984,10,14,300,0
10/15/84,286.0340387,1984,10,15,200,3333.3
10/16/84,286.014621,1984,10,16,100,6666.7
10/17/84,285.9536366,1984,10,17,0,10000
10/18/84,285.7521565,1984,10,18,525,37500
10/19/84,285.6879243,1984,10,19,1050,65000
10/20/84,285.6235777,1984,10,20,1575,92500
10/21/84,285.5790508,1984,10,21,2100,120000
10/22/84,285.5532865,1984,10,22,13250,95000
10/23/84,285.4208914,1984,10,23,200,0
10/24/84,285.3652865,1984,10,24,100,0
10/25/84,285.3479208,1984,10,25,550,5000
10/26/84,285.3319936,1984,10,26,300,2500
10/27/84,285.235855,1984,10,27,50,0
10/28/84,285.2277718,1984,10,28,2450,6111.1
10/29/84,285.1855846,1984,10,29,4850,12222.2
10/30/84,285.1277718,1984,10,30,7250,18333.3
10/31/84,284.9863229,1984,10,31,9650,24444.4
4/1/85,280.438992,1985,4,1,12050,30555.6
4/2/85,280.281914,1985,4,2,14450,36666.7
4/3/85,280.3476714,1985,4,3,16850,42777.8
4/4/85,280.3455466,1985,4,4,19250,48888.9
4/5/85,280.3465067,1985,4,5,21650,55000
4/6/85,280.2590371,1985,4,6,9050,7500
4/7/85,280.6822433,1985,4,7,5925,11250
4/8/85,280.7112,1985,4,8,2800,15000
4/9/85,280.6182052,1985,4,9,3450,10000
4/10/85,280.630732,1985,4,10,4100,5000
4/11/85,280.5520423,1985,4,11,3514,4285.7
4/12/85,280.5263715,1985,4,12,2929,3571.4
4/13/85,280.6668499,1985,4,13,2343,2857.1
4/14/85,280.8966627,1985,4,14,1757,2142.9
4/15/85,280.9475258,1985,4,15,1171,1428.6
4/16/85,281.1012727,1985,4,16,586,714.3
4/17/85,281.2725795,1985,4,17,0,0
4/18/85,281.2071861,1985,4,18,0,0
4/19/85,281.0878377,1985,4,19,20875,50000
4/20/85,281.0724235,1985,4,20,41750,100000
4/21/85,281.2323195,1985,4,21,2050,15000
4/22/85,281.3320214,1985,4,22,1914,13214.3
4/23/85,281.4373421,1985,4,23,1779,11428.6
4/24/85,281.4677788,1985,4,24,1643,9642.9
4/25/85,281.3773005,1985,4,25,1507,7857.1
4/26/85,281.2806072,1985,4,26,1371,6071.4
4/27/85,281.281914,1985,4,27,1236,4285.7
4/28/85,281.3045379,1985,4,28,1100,2500
4/29/85,281.3010301,1985,4,29,2050,2500
4/30/85,281.3618065,1985,4,30,4400,10000
5/1/85,281.4450717,1985,5,1,15800,20000
5/2/85,281.4335778,1985,5,2,27200,30000
5/3/85,281.4319937,1985,5,3,38600,40000
5/4/85,281.4514842,1985,5,4,35500,252500
5/5/85,281.4574287,1985,5,5,23667,168333.3
5/6/85,281.6187112,1985,5,6,11833,84166.7
5/7/85,282.0136783,1985,5,7,0,0
5/8/85,282.0572554,1985,5,8,250,2500
5/9/85,281.626732,1985,5,9,288,3125
5/10/85,281.75468,1985,5,10,325,3750
5/11/85,281.9896124,1985,5,11,363,4375
5/12/85,282.3085795,1985,5,12,400,5000
5/13/85,282.3293074,1985,5,13,320,4000
5/14/85,282.2733282,1985,5,14,240,3000
5/15/85,282.2757719,1985,5,15,160,2000
5/16/85,282.2537372,1985,5,16,80,1000
5/17/85,282.2566592,1985,5,17,0,0
5/18/85,282.3402467,1985,5,18,11350,167500
5/19/85,282.3727528,1985,5,19,1700,7500
5/20/85,282.374115,1985,5,20,1471,7500
5/21/85,282.5157303,1985,5,21,1243,7500
5/22/85,282.7056089,1985,5,22,1014,7500
5/23/85,282.7941705,1985,5,23,786,7500
5/24/85,282.8211167,1985,5,24,557,7500
5/25/85,282.8256921,1985,5,25,329,7500
5/26/85,282.8360977,1985,5,26,100,7500
5/27/85,282.7195396,1985,5,27,1233,7500
5/28/85,282.5908914,1985,5,28,2367,7500
5/29/85,282.9065032,1985,5,29,3500,7500
5/30/85,283.0653212,1985,5,30,8175,148750
5/31/85,283.4026661,1985,5,31,12850,290000
6/1/85,283.6635396,1985,6,1,1400,237500
6/2/85,283.7973004,1985,6,2,2900,193750
6/3/85,284.1147146,1985,6,3,4400,150000
6/4/85,284.1590058,1985,6,4,4613,114375
6/5/85,284.0990612,1985,6,5,4825,78750
6/6/85,283.3593698,1985,6,6,5038,43125
6/7/85,283.4736297,1985,6,7,5250,7500
6/8/85,283.4919001,1985,6,8,3938,10000
6/9/85,283.4559209,1985,6,9,2625,12500
6/10/85,283.4413386,1985,6,10,1313,15000
6/11/85,283.7080665,1985,6,11,0,17500
6/12/85,283.5654391,1985,6,12,650,22500
6/13/85,283.5617926,1985,6,13,1300,27500
6/14/85,283.7873108,1985,6,14,1950,32500
6/15/85,283.8238654,1985,6,15,2600,37500
6/16/85,283.9424547,1985,6,16,3221,53125
6/17/85,284.2087216,1985,6,17,3842,68750
6/18/85,284.4303472,1985,6,18,4463,84375
6/19/85,284.44416,1985,6,19,5083,100000
6/20/85,284.4923368,1985,6,20,5704,115625
6/21/85,284.4993628,1985,6,21,6325,131250
6/22/85,284.5887146,1985,6,22,6946,146875
6/23/85,284.6667735,1985,6,23,7567,162500
6/24/85,284.5972311,1985,6,24,8188,178125
6/25/85,284.5480734,1985,6,25,8808,193750
6/26/85,284.5529503,1985,6,26,9429,209375
6/27/85,284.5547077,1985,6,27,10050,225000
6/28/85,284.5561877,1985,6,28,50,5000
6/29/85,284.5717961,1985,6,29,50,4285.7
6/30/85,284.6211271,1985,6,30,50,3571.4
7/1/85,284.662212,1985,7,1,50,2857.1
7/2/85,284.6924304,1985,7,2,50,2142.9
7/3/85,284.7158169,1985,7,3,50,1428.6
7/4/85,284.7387735,1985,7,4,50,714.3
7/5/85,284.7610404,1985,7,5,50,0
7/6/85,285.5352519,1985,7,6,3188,15000
7/7/85,285.642874,1985,7,7,6325,30000
7/8/85,285.6301877,1985,7,8,9463,45000
7/9/85,285.5936643,1985,7,9,12600,60000
7/10/85,285.5682085,1985,7,10,15738,75000
7/11/85,285.5566869,1985,7,11,18875,90000
7/12/85,285.7226175,1985,7,12,22013,105000
7/13/85,285.7035569,1985,7,13,25150,120000
7/14/85,285.9886037,1985,7,14,150,0
7/15/85,286.166205,1985,7,15,120,0
7/16/85,286.1684477,1985,7,16,90,0
7/17/85,286.0903645,1985,7,17,60,0
7/18/85,286.0918446,1985,7,18,30,0
7/19/85,286.0028983,1985,7,19,0,0
7/20/85,285.9714875,1985,7,20,100,6250
7/21/85,285.9801565,1985,7,21,200,12500
7/22/85,286.5626834,1985,7,22,2600,53000
7/23/85,286.6713004,1985,7,23,5000,93500
7/24/85,286.6771478,1985,7,24,7400,134000
7/25/85,286.6771617,1985,7,25,9800,174500
7/26/85,286.6539624,1985,7,26,12200,215000
7/27/85,286.6317128,1985,7,27,8817,196666.7
7/28/85,286.5428359,1985,7,28,5433,178333.3
7/29/85,286.5936123,1985,7,29,2050,160000
7/30/85,286.6025309,1985,7,30,1918,145909.1
7/31/85,286.5551132,1985,7,31,1786,131818.2
8/1/85,286.5976366,1985,8,1,1655,117727.3
8/2/85,286.5283125,1985,8,2,1523,103636.4
8/3/85,286.5645205,1985,8,3,1391,89545.5
8/4/85,286.7172518,1985,8,4,1259,75454.5
8/5/85,286.5872934,1985,8,5,1127,61363.6
8/6/85,286.5333627,1985,8,6,995,47272.7
8/7/85,286.5539555,1985,8,7,864,33181.8
8/8/85,286.6149087,1985,8,8,732,19090.9
8/9/85,286.7369572,1985,8,9,600,5000
8/10/85,286.755134,1985,8,10,2200,32500
8/11/85,286.7235984,1985,8,11,1850,27916.7
8/12/85,286.6269121,1985,8,12,1500,23333.3
8/13/85,286.5956435,1985,8,13,1150,18750
8/14/85,286.5808497,1985,8,14,800,14166.7
8/15/85,286.587179,1985,8,15,450,9583.3
8/16/85,286.5512969,1985,8,16,100,5000
8/17/85,286.5339589,1985,8,17,913,7500
8/18/85,285.9494771,1985,8,18,1725,10000
8/19/85,285.6895638,1985,8,19,2538,12500
8/20/85,285.7108567,1985,8,20,3350,15000
8/21/85,285.7615915,1985,8,21,3500,175000
8/22/85,286.043335,1985,8,22,2050,130000
8/23/85,286.0915118,1985,8,23,3825,326250
8/24/85,285.959387,1985,8,24,5600,522500
8/25/85,285.8575777,1985,8,25,3900,232500
8/26/85,285.8213004,1985,8,26,3579,213125
8/27/85,285.8458584,1985,8,27,3258,193750
8/28/85,285.9229052,1985,8,28,2938,174375
8/29/85,285.960718,1985,8,29,2617,155000
8/30/85,285.9498931,1985,8,30,2296,135625
8/31/85,285.9580872,1985,8,31,1975,116250
9/1/85,285.973848,1985,9,1,1654,96875
9/2/85,285.9835811,1985,9,2,1333,77500
9/3/85,285.9886175,1985,9,3,1013,58125
9/4/85,286.1795777,1985,9,4,692,38750
9/5/85,286.1143021,1985,9,5,371,19375
9/6/85,286.1134113,1985,9,6,50,0
9/7/85,286.0610681,1985,9,7,4550,50000
9/8/85,285.5833697,1985,9,8,3950,47916.7
9/9/85,285.3935673,1985,9,9,3350,45833.3
9/10/85,285.830569,1985,9,10,2750,43750
9/11/85,285.8836401,1985,9,11,2150,41666.7
9/12/85,286.471751,1985,9,12,1550,39583.3
9/13/85,286.5219624,1985,9,13,950,37500
9/14/85,286.4884581,1985,9,14,9550,22500
9/15/85,286.3024165,1985,9,15,1100,65000
9/16/85,286.1909607,1985,9,16,1500,37500
9/17/85,286.1558307,1985,9,17,1900,10000
9/18/85,286.1553524,1985,9,18,2133,11666.7
9/19/85,286.1456955,1985,9,19,2367,13333.3
9/20/85,286.1331375,1985,9,20,2600,15000
9/21/85,286.1462189,1985,9,21,2050,81666.7
9/22/85,286.1303264,1985,9,22,1500,148333.3
9/23/85,286.1165274,1985,9,23,950,215000
9/24/85,286.2869364,1985,9,24,300,57500
9/25/85,286.3379797,1985,9,25,1050,64500
9/26/85,286.3088602,1985,9,26,1800,71500
9/27/85,286.0473766,1985,9,27,2550,78500
9/28/85,286.4052969,1985,9,28,3300,85500
9/29/85,286.4466348,1985,9,29,4050,92500
9/30/85,286.3561288,1985,9,30,4358,83333.3
10/1/85,286.3760421,1985,10,1,4667,74166.7
10/2/85,286.4594841,1985,10,2,4975,65000
10/3/85,286.496257,1985,10,3,5283,55833.3
10/4/85,286.509692,1985,10,4,5592,46666.7
10/5/85,286.4790889,1985,10,5,5900,37500
10/6/85,286.1524789,1985,10,6,6708,32083.3
10/7/85,286.1307042,1985,10,7,7517,26666.7
10/8/85,286.2024789,1985,10,8,8325,21250
10/9/85,285.9870161,1985,10,9,9133,15833.3
10/10/85,285.9558411,1985,10,10,9942,10416.7
10/11/85,285.846361,1985,10,11,10750,5000
10/12/85,285.8352241,1985,10,12,700,0
10/13/85,285.707491,1985,10,13,600,6250
10/14/85,285.6616297,1985,10,14,500,12500
10/15/85,285.8554044,1985,10,15,400,18750
10/16/85,285.8629572,1985,10,16,300,25000
10/17/85,285.7097683,1985,10,17,200,31250
10/18/85,286.020822,1985,10,18,100,37500
10/19/85,286.0314355,1985,10,19,2350,145000
10/20/85,286.0021843,1985,10,20,300,22500
10/21/85,285.9556539,1985,10,21,6300,212500
10/22/85,285.6325309,1985,10,22,5954,196730.8
10/23/85,285.6634564,1985,10,23,5608,180961.5
10/24/85,285.723796,1985,10,24,5262,165192.3
10/25/85,285.8320317,1985,10,25,4915,149423.1
10/26/85,285.7981461,1985,10,26,4569,133653.8
10/27/85,285.5820213,1985,10,27,4223,117884.6
10/28/85,285.3871201,1985,10,28,3877,102115.4
10/29/85,285.3558342,1985,10,29,3531,86346.2
10/30/85,285.3732311,1985,10,30,3185,70576.9
10/31/85,285.3540768,1985,10,31,2838,54807.7
4/1/86,280.5488222,1986,4,1,2492,39038.5
4/2/86,280.325245,1986,4,2,2146,23269.2
4/3/86,280.2671514,1986,4,3,1800,7500
4/4/86,280.2656852,1986,4,4,1543,6428.6
4/5/86,280.4063369,1986,4,5,1286,5357.1
4/6/86,280.4832693,1986,4,6,1029,4285.7
4/7/86,280.3579452,1986,4,7,771,3214.3
4/8/86,280.3260423,1986,4,8,514,2142.9
4/9/86,280.1634426,1986,4,9,257,1071.4
4/10/86,280.4192762,1986,4,10,0,0
4/11/86,280.4823508,1986,4,11,450,7500
4/12/86,280.5049469,1986,4,12,0,0
4/13/86,280.5044097,1986,4,13,36,0
4/14/86,280.5031722,1986,4,14,71,0
4/15/86,280.5012589,1986,4,15,107,0
4/16/86,280.5157338,1986,4,16,143,0
4/17/86,280.2246246,1986,4,17,179,0
4/18/86,280.1967355,1986,4,18,214,0
4/19/86,280.2688118,1986,4,19,250,0
4/20/86,280.1179417,1986,4,20,260,0
4/21/86,279.938739,1986,4,21,270,0
4/22/86,279.934531,1986,4,22,280,0
4/23/86,280.0169227,1986,4,23,290,0
4/24/86,280.2686904,1986,4,24,300,0
4/25/86,280.3278412,1986,4,25,14200,7500
4/26/86,280.3627078,1986,4,26,18600,42500
4/27/86,280.3900423,1986,4,27,23000,77500
4/28/86,280.3734149,1986,4,28,27400,112500
4/29/86,280.3905137,1986,4,29,13500,20000
4/30/86,280.4348534,1986,4,30,12150,18000
5/1/86,281.0302398,1986,5,1,10800,16000
5/2/86,281.0687771,1986,5,2,9450,14000
5/3/86,280.6433282,1986,5,3,8100,12000
5/4/86,280.639862,1986,5,4,6750,10000
5/5/86,280.6431064,1986,5,5,5400,8000
5/6/86,280.8603265,1986,5,6,4050,6000
5/7/86,280.9493178,1986,5,7,2700,4000
5/8/86,280.8742537,1986,5,8,1350,2000
5/9/86,280.7915189,1986,5,9,0,0
5/10/86,280.8054079,1986,5,10,5300,215000
5/11/86,281.2830301,1986,5,11,1200,20000
5/12/86,281.3195639,1986,5,12,1588,20769.2
5/13/86,281.3092589,1986,5,13,1977,21538.5
5/14/86,281.3106835,1986,5,14,2365,22307.7
5/15/86,281.4079625,1986,5,15,2754,23076.9
5/16/86,281.4424374,1986,5,16,3142,23846.2
5/17/86,281.4511584,1986,5,17,3531,24615.4
5/18/86,281.4634079,1986,5,18,3919,25384.6
5/19/86,281.5721497,1986,5,19,4308,26153.8
5/20/86,281.8247632,1986,5,20,4696,26923.1
5/21/86,281.7936367,1986,5,21,5085,27692.3
5/22/86,281.4710856,1986,5,22,5473,28461.5
5/23/86,281.4333525,1986,5,23,5862,29230.8
5/24/86,281.4915154,1986,5,24,6250,30000
5/25/86,281.5156194,1986,5,25,3525,16250
5/26/86,281.4796887,1986,5,26,800,2500
5/27/86,281.5953386,1986,5,27,8900,7500
5/28/86,281.7570821,1986,5,28,1550,70000
5/29/86,281.8597476,1986,5,29,2680,70500
5/30/86,281.8846384,1986,5,30,3810,71000
5/31/86,281.9037615,1986,5,31,4940,71500
6/1/86,281.91807,1986,6,1,6070,72000
6/2/86,281.9287528,1986,6,2,7200,72500
6/3/86,282.1038343,1986,6,3,8330,73000
6/4/86,282.1862849,1986,6,4,9460,73500
6/5/86,282.1948533,1986,6,5,10590,74000
6/6/86,282.8046453,1986,6,6,11720,74500
6/7/86,282.8230959,1986,6,7,12850,75000
6/8/86,282.5979174,1986,6,8,50,0
6/9/86,282.5935777,1986,6,9,270,0
6/10/86,282.599349,1986,6,10,490,0
6/11/86,283.4923438,1986,6,11,710,0
6/12/86,283.551855,1986,6,12,930,0
6/13/86,283.0996921,1986,6,13,1150,0
6/14/86,283.6078654,1986,6,14,400,57500
6/15/86,283.614316,1986,6,15,450,0
6/16/86,283.596524,1986,6,16,225,0
6/17/86,283.7791583,1986,6,17,0,0
6/18/86,283.7916054,1986,6,18,0,17500
6/19/86,283.829037,1986,6,19,1840,29000
6/20/86,283.804219,1986,6,20,3680,40500
6/21/86,283.8141808,1986,6,21,5520,52000
6/22/86,283.8413975,1986,6,22,7360,63500
6/23/86,283.9140456,1986,6,23,9200,75000
6/24/86,284.0036436,1986,6,24,1700,5000
6/25/86,284.2364027,1986,6,25,1588,3750
6/26/86,284.2886453,1986,6,26,1475,2500
6/27/86,284.5039694,1986,6,27,1363,1250
6/28/86,284.5699105,1986,6,28,1250,0
6/29/86,284.5596262,1986,6,29,7300,17500
6/30/86,285.0171132,1986,6,30,5475,13125
7/1/86,285.1000734,1986,7,1,3650,8750
7/2/86,285.4767111,1986,7,2,1825,4375
7/3/86,285.7490889,1986,7,3,0,0
7/4/86,285.7508359,1986,7,4,14050,62500
7/5/86,285.8086245,1986,7,5,21300,150000
7/6/86,285.8742432,1986,7,6,17775,125000
7/7/86,285.8518827,1986,7,7,14250,100000
7/8/86,285.8692622,1986,7,8,10725,75000
7/9/86,285.9016054,1986,7,9,7200,50000
7/10/86,285.9205274,1986,7,10,3675,25000
7/11/86,285.9524581,1986,7,11,150,0
7/12/86,285.9608428,1986,7,12,6900,22500
7/13/86,285.961907,1986,7,13,100,17500
7/14/86,285.9627354,1986,7,14,489,18055.6
7/15/86,285.9628914,1986,7,15,878,18611.1
7/16/86,285.9572761,1986,7,16,1267,19166.7
7/17/86,285.9539936,1986,7,17,1656,19722.2
7/18/86,285.9389607,1986,7,18,2044,20277.8
7/19/86,285.9245655,1986,7,19,2433,20833.3
7/20/86,285.9150231,1986,7,20,2822,21388.9
7/21/86,285.3360664,1986,7,21,3211,21944.4
7/22/86,285.2455326,1986,7,22,3600,22500
7/23/86,285.4923506,1986,7,23,24700,32500
7/24/86,285.5097614,1986,7,24,200,2500
7/25/86,285.5299659,1986,7,25,188,2343.8
7/26/86,285.5393385,1986,7,26,175,2187.5
7/27/86,285.5080664,1986,7,27,163,2031.3
7/28/86,285.4738446,1986,7,28,150,1875
7/29/86,285.6051167,1986,7,29,138,1718.8
7/30/86,285.5942917,1986,7,30,125,1562.5
7/31/86,285.4821253,1986,7,31,113,1406.3
8/1/86,285.4910543,1986,8,1,100,1250
8/2/86,285.5089503,1986,8,2,88,1093.8
8/3/86,285.5058688,1986,8,3,75,937.5
8/4/86,285.7321184,1986,8,4,63,781.3
8/5/86,285.6075673,1986,8,5,50,625
8/6/86,285.5323853,1986,8,6,38,468.8
8/7/86,285.5069572,1986,8,7,25,312.5
8/8/86,285.5246279,1986,8,8,13,156.3
8/9/86,285.9055465,1986,8,9,0,0
8/10/86,286.0279901,1986,8,10,50,0
8/11/86,286.089952,1986,8,11,33,0
8/12/86,285.8876678,1986,8,12,17,0
8/13/86,285.9949815,1986,8,13,0,0
8/14/86,285.9848983,1986,8,14,3100,20000
8/15/86,285.9978168,1986,8,15,0,0
8/16/86,286.0525621,1986,8,16,940,0
8/17/86,286.0045031,1986,8,17,1880,0
8/18/86,285.9570404,1986,8,18,2820,0
8/19/86,286.2294217,1986,8,19,3760,0
8/20/86,286.371238,1986,8,20,4700,0
8/21/86,286.393543,1986,8,21,4000,14166.7
8/22/86,286.2660179,1986,8,22,3300,28333.3
8/23/86,285.9090369,1986,8,23,2600,42500
8/24/86,286.2432102,1986,8,24,4200,45000
8/25/86,286.2738064,1986,8,25,5800,47500
8/26/86,286.008718,1986,8,26,7400,50000
8/27/86,285.4294182,1986,8,27,9000,52500
8/28/86,285.2971271,1986,8,28,10600,55000
8/29/86,285.2027423,1986,8,29,12200,57500
8/30/86,285.3164096,1986,8,30,13800,60000
8/31/86,285.3427146,1986,8,31,0,0
9/1/86,285.228569,1986,9,1,0,277.8
9/2/86,285.2779416,1986,9,2,0,555.6
9/3/86,285.2881669,1986,9,3,0,833.3
9/4/86,285.2849295,1986,9,4,0,1111.1
9/5/86,285.2896886,1986,9,5,0,1388.9
9/6/86,285.3349572,1986,9,6,0,1666.7
9/7/86,285.3356158,1986,9,7,0,1944.4
9/8/86,285.5740768,1986,9,8,0,2222.2
9/9/86,285.6047908,1986,9,9,0,2500
9/10/86,285.3149018,1986,9,10,0,0
9/11/86,285.4550196,1986,9,11,0,0
9/12/86,285.5475603,1986,9,12,0,0
9/13/86,285.7106903,1986,9,13,567,13333.3
9/14/86,285.7679936,1986,9,14,1133,26666.7
9/15/86,285.3595985,1986,9,15,1700,40000
9/16/86,285.2853766,1986,9,16,2100,57500
9/17/86,285.343907,1986,9,17,1075,31250
9/18/86,285.3232241,1986,9,18,50,5000
9/19/86,285.273751,1986,9,19,9350,397500
9/20/86,285.2346799,1986,9,20,950,2500
9/21/86,285.2214806,1986,9,21,1150,0
9/22/86,285.2098723,1986,9,22,940,0
9/23/86,285.2002571,1986,9,23,730,0
9/24/86,285.3049503,1986,9,24,520,0
9/25/86,285.3290335,1986,9,25,310,0
9/26/86,285.5091375,1986,9,26,100,0
9/27/86,285.5219867,1986,9,27,0,7500
9/28/86,285.5298446,1986,9,28,1186,34285.7
9/29/86,285.7110959,1986,9,29,2371,61071.4
9/30/86,285.7218099,1986,9,30,3557,87857.1
10/1/86,285.6674217,1986,10,1,4743,114642.9
10/2/86,285.6384754,1986,10,2,5929,141428.6
10/3/86,285.7270959,1986,10,3,7114,168214.3
10/4/86,285.8334841,1986,10,4,8300,195000
10/5/86,285.8415187,1986,10,5,6917,162500
10/6/86,285.7692033,1986,10,6,5533,130000
10/7/86,285.7372172,1986,10,7,4150,97500
10/8/86,285.7093246,1986,10,8,2767,65000
10/9/86,285.4711444,1986,10,9,1383,32500
10/10/86,285.5924026,1986,10,10,0,0
10/11/86,285.6443888,1986,10,11,23,576.9
10/12/86,285.5665551,1986,10,12,46,1153.8
10/13/86,285.4310231,1986,10,13,69,1730.8
10/14/86,285.5810092,1986,10,14,92,2307.7
10/15/86,285.6400525,1986,10,15,115,2884.6
10/16/86,285.5838515,1986,10,16,138,3461.5
10/17/86,285.4959416,1986,10,17,162,4038.5
10/18/86,285.4400352,1986,10,18,185,4615.4
10/19/86,285.3733974,1986,10,19,208,5192.3
10/20/86,285.2131271,1986,10,20,231,5769.2
10/21/86,285.1531825,1986,10,21,254,6346.2
10/22/86,285.1461115,1986,10,22,277,6923.1
10/23/86,285.0216193,1986,10,23,300,7500
10/24/86,284.9827562,1986,10,24,1750,7500
10/25/86,284.9425898,1986,10,25,2183,5000
10/26/86,284.9967597,1986,10,26,2617,2500
10/27/86,285.0001843,1986,10,27,3050,0
10/28/86,284.952011,1986,10,28,50,0
10/29/86,284.9219416,1986,10,29,83,833.3
10/30/86,284.8740976,1986,10,30,117,1666.7
10/31/86,284.8593559,1986,10,31,150,2500
4/1/87,280.0317268,1987,4,1,183,3333.3
4/2/87,280.1895674,1987,4,2,217,4166.7
4/3/87,280.178323,1987,4,3,250,5000
4/4/87,280.12433,1987,4,4,294,6875
4/5/87,280.2136506,1987,4,5,338,8750
4/6/87,280.2986281,1987,4,6,381,10625
4/7/87,279.833349,1987,4,7,425,12500
4/8/87,279.7675015,1987,4,8,469,14375
4/9/87,279.853297,1987,4,9,513,16250
4/10/87,279.92607,1987,4,10,556,18125
4/11/87,280.1753317,1987,4,11,600,20000
4/12/87,280.1520908,1987,4,12,0,0
4/13/87,279.9311307,1987,4,13,11100,5000
4/14/87,279.9556125,1987,4,14,0,0
4/15/87,279.927297,1987,4,15,3600,15000
4/16/87,280.3493352,1987,4,16,3400,7500
4/17/87,280.8197996,1987,4,17,3200,0
4/18/87,280.8937442,1987,4,18,16000,22500
4/19/87,281.0767632,1987,4,19,15213,22500
4/20/87,281.1352485,1987,4,20,14425,22500
4/21/87,281.1182779,1987,4,21,13638,22500
4/22/87,281.1111098,1987,4,22,12850,22500
4/23/87,281.1049677,1987,4,23,12063,22500
4/24/87,281.1413975,1987,4,24,11275,22500
4/25/87,281.1594981,1987,4,25,10488,22500
4/26/87,281.1614079,1987,4,26,9700,22500
4/27/87,281.2468256,1987,4,27,8913,22500
4/28/87,281.3897615,1987,4,28,8125,22500
4/29/87,281.4174876,1987,4,29,7338,22500
4/30/87,281.4432069,1987,4,30,6550,22500
5/1/87,281.4573421,1987,5,1,5763,22500
5/2/87,281.4290613,1987,5,2,4975,22500
5/3/87,281.3553351,1987,5,3,4188,22500
5/4/87,281.334167,1987,5,4,3400,22500
5/5/87,281.3486107,1987,5,5,2613,22500
5/6/87,281.5354876,1987,5,6,1825,22500
5/7/87,281.5877823,1987,5,7,1038,22500
5/8/87,281.7567112,1987,5,8,250,22500
5/9/87,281.8249296,1987,5,9,2969,41875
5/10/87,281.8191549,1987,5,10,5688,61250
5/11/87,281.8135951,1987,5,11,8406,80625
5/12/87,281.8079278,1987,5,12,11125,100000
5/13/87,281.8721566,1987,5,13,13844,119375
5/14/87,282.0450128,1987,5,14,16563,138750
5/15/87,282.0727355,1987,5,15,19281,158125
5/16/87,282.0149018,1987,5,16,22000,177500
5/17/87,281.8176298,1987,5,17,850,0
5/18/87,281.9638204,1987,5,18,11475,1875
5/19/87,282.3212901,1987,5,19,22100,3750
5/20/87,282.3168221,1987,5,20,32725,5625
5/21/87,282.2132207,1987,5,21,43350,7500
5/22/87,282.2385414,1987,5,22,36317,7083.3
5/23/87,283.1343715,1987,5,23,29283,6666.7
5/24/87,283.2008429,1987,5,24,22250,6250
5/25/87,283.0757718,1987,5,25,15217,5833.3
5/26/87,282.7989122,1987,5,26,8183,5416.7
5/27/87,282.9643646,1987,5,27,1150,5000
5/28/87,283.0337441,1987,5,28,4650,5000
5/29/87,283.0726488,1987,5,29,3700,5000
5/30/87,282.9997094,1987,5,30,2750,5000
5/31/87,283.0038273,1987,5,31,1800,5000
6/1/87,283.2178065,1987,6,1,850,5000
6/2/87,283.3135847,1987,6,2,725,5000
6/3/87,283.335297,1987,6,3,600,5000
6/4/87,283.7563022,1987,6,4,475,5000
6/5/87,283.8896852,1987,6,5,350,5000
6/6/87,283.8808741,1987,6,6,713,10000
6/7/87,283.8732034,1987,6,7,1075,15000
6/8/87,283.8665101,1987,6,8,1438,20000
6/9/87,283.8606037,1987,6,9,1800,25000
6/10/87,283.4598204,1987,6,10,2163,30000
6/11/87,283.1630093,1987,6,11,2525,35000
6/12/87,283.166316,1987,6,12,2888,40000
6/13/87,283.1592519,1987,6,13,3250,45000
6/14/87,283.373141,1987,6,14,1150,30000
6/15/87,283.2596263,1987,6,15,2300,33000
6/16/87,283.3080283,1987,6,16,3450,36000
6/17/87,283.8679451,1987,6,17,4600,39000
6/18/87,283.9022814,1987,6,18,5750,42000
6/19/87,284.074628,1987,6,19,6900,45000
6/20/87,284.1013905,1987,6,20,8050,48000
6/21/87,284.1645552,1987,6,21,9200,51000
6/22/87,284.5417406,1987,6,22,10350,54000
6/23/87,284.5738689,1987,6,23,11500,57000
6/24/87,284.9192276,1987,6,24,12650,60000
6/25/87,284.9422085,1987,6,25,9650,140000
6/26/87,284.9076193,1987,6,26,9431,134218.8
6/27/87,284.9132241,1987,6,27,9213,128437.5
6/28/87,284.951803,1987,6,28,8994,122656.3
6/29/87,285.0258238,1987,6,29,8775,116875
6/30/87,284.9022432,1987,6,30,8556,111093.8
7/1/87,284.8655396,1987,7,1,8338,105312.5
7/2/87,284.8633836,1987,7,2,8119,99531.3
7/3/87,284.8616643,1987,7,3,7900,93750
7/4/87,284.8613905,1987,7,4,7681,87968.8
7/5/87,284.8551583,1987,7,5,7463,82187.5
7/6/87,284.8785898,1987,7,6,7244,76406.3
7/7/87,285.4322779,1987,7,7,7025,70625
7/8/87,285.7284685,1987,7,8,6806,64843.8
7/9/87,285.7657163,1987,7,9,6588,59062.5
7/10/87,285.7651756,1987,7,10,6369,53281.3
7/11/87,285.7364789,1987,7,11,6150,47500
7/12/87,285.7297267,1987,7,12,450,20000
7/13/87,285.7322882,1987,7,13,370,16000
7/14/87,285.7345898,1987,7,14,290,12000
7/15/87,285.7597475,1987,7,15,210,8000
7/16/87,285.7658168,1987,7,16,130,4000
7/17/87,285.8760941,1987,7,17,50,0
7/18/87,285.9663298,1987,7,18,360,9000
7/19/87,285.8660491,1987,7,19,670,18000
7/20/87,286.2236262,1987,7,20,980,27000
7/21/87,286.230368,1987,7,21,1290,36000
7/22/87,285.9477406,1987,7,22,1600,45000
7/23/87,285.8715257,1987,7,23,50,2500
7/24/87,285.8676886,1987,7,24,504,3214.3
7/25/87,285.8934217,1987,7,25,957,3928.6
7/26/87,285.9125274,1987,7,26,1411,4642.9
7/27/87,285.9274182,1987,7,27,1864,5357.1
7/28/87,285.9399867,1987,7,28,2318,6071.4
7/29/87,286.0940075,1987,7,29,2771,6785.7
7/30/87,286.1754667,1987,7,30,3225,7500
7/31/87,286.1548879,1987,7,31,3679,8214.3
8/1/87,286.144569,1987,8,1,4132,8928.6
8/2/87,286.1500872,1987,8,2,4586,9642.9
8/3/87,286.2799277,1987,8,3,5039,10357.1
8/4/87,286.6436608,1987,8,4,5493,11071.4
8/5/87,286.6321392,1987,8,5,5946,11785.7
8/6/87,286.3881946,1987,8,6,6400,12500
8/7/87,286.3290092,1987,8,7,14850,182500
8/8/87,286.3818515,1987,8,8,5600,25000
8/9/87,286.3372726,1987,8,9,250,27500
8/10/87,286.2935222,1987,8,10,413,21250
8/11/87,286.3486626,1987,8,11,575,15000
8/12/87,286.3765378,1987,8,12,738,8750
8/13/87,286.4793801,1987,8,13,900,2500
8/14/87,286.7223541,1987,8,14,0,0
8/15/87,286.8018965,1987,8,15,125,2613.6
8/16/87,287.1485516,1987,8,16,250,5227.3
8/17/87,287.2418896,1987,8,17,375,7840.9
8/18/87,287.4461426,1987,8,18,500,10454.5
8/19/87,287.5646799,1987,8,19,625,13068.2
8/20/87,287.5188705,1987,8,20,750,15681.8
8/21/87,287.4752587,1987,8,21,875,18295.5
8/22/87,287.6227596,1987,8,22,1000,20909.1
8/23/87,287.6339624,1987,8,23,1125,23522.7
8/24/87,287.6067735,1987,8,24,1250,26136.4
8/25/87,287.6128844,1987,8,25,1375,28750
8/26/87,287.3700872,1987,8,26,1500,31363.6
8/27/87,287.3427804,1987,8,27,1625,33977.3
8/28/87,287.320153,1987,8,28,1750,36590.9
8/29/87,287.2982258,1987,8,29,1875,39204.5
8/30/87,287.2032691,1987,8,30,2000,41818.2
8/31/87,287.1414633,1987,8,31,2125,44431.8
9/1/87,287.1798688,1987,9,1,2250,47045.5
9/2/87,287.1694806,1987,9,2,2375,49659.1
9/3/87,287.0960421,1987,9,3,2500,52272.7
9/4/87,287.0655811,1987,9,4,2625,54886.4
9/5/87,287.2402813,1987,9,5,2750,57500
9/6/87,287.2648879,1987,9,6,400,27500
9/7/87,287.2432691,1987,9,7,2950,235000
9/8/87,287.147997,1987,9,8,2213,176875
9/9/87,287.136725,1987,9,9,1475,118750
9/10/87,286.9545828,1987,9,10,738,60625
9/11/87,286.8754875,1987,9,11,0,2500
9/12/87,286.9666071,1987,9,12,750,23333.3
9/13/87,287.0317094,1987,9,13,1500,44166.7
9/14/87,287.0363853,1987,9,14,2250,65000
9/15/87,286.9181808,1987,9,15,450,2500
9/16/87,286.8891617,1987,9,16,700,26875
9/17/87,286.8416262,1987,9,17,950,51250
9/18/87,286.9474979,1987,9,18,1200,75625
9/19/87,286.9995118,1987,9,19,1450,100000
9/20/87,286.9851548,1987,9,20,3064,104285.7
9/21/87,286.9716886,1987,9,21,4679,108571.4
9/22/87,287.0086695,1987,9,22,6293,112857.1
9/23/87,286.9301773,1987,9,23,7907,117142.9
9/24/87,286.7438549,1987,9,24,9521,121428.6
9/25/87,286.5455707,1987,9,25,11136,125714.3
9/26/87,286.4161253,1987,9,26,12750,130000
9/27/87,286.4467042,1987,9,27,14364,134285.7
9/28/87,286.6148879,1987,9,28,15979,138571.4
9/29/87,286.6671236,1987,9,29,17593,142857.1
9/30/87,286.6710196,1987,9,30,19207,147142.9
10/1/87,286.549595,1987,10,1,20821,151428.6
10/2/87,286.3633628,1987,10,2,22436,155714.3
10/3/87,286.5432172,1987,10,3,24050,160000
10/4/87,286.6560179,1987,10,4,20042,135000
10/5/87,286.5379277,1987,10,5,16033,110000
10/6/87,286.2787804,1987,10,6,12025,85000
10/7/87,286.204257,1987,10,7,8017,60000
10/8/87,286.0961531,1987,10,8,4008,35000
10/9/87,286.0258515,1987,10,9,0,10000
10/10/87,285.7774979,1987,10,10,25,8750
10/11/87,285.686517,1987,10,11,50,7500
10/12/87,285.5666661,1987,10,12,75,6250
10/13/87,285.5318862,1987,10,13,100,5000
10/14/87,285.3171999,1987,10,14,125,3750
10/15/87,285.2658238,1987,10,15,150,2500
10/16/87,285.2567423,1987,10,16,150,12500
10/17/87,285.3378134,1987,10,17,100,5000
10/18/87,285.4186453,1987,10,18,450,2500
10/19/87,285.5006383,1987,10,19,1280,10000
10/20/87,285.3611548,1987,10,20,2110,17500
10/21/87,285.1361184,1987,10,21,2940,25000
10/22/87,284.8909052,1987,10,22,3770,32500
10/23/87,284.8477025,1987,10,23,4600,40000
10/24/87,284.8386453,1987,10,24,5430,47500
10/25/87,284.7665933,1987,10,25,6260,55000
10/26/87,284.6114113,1987,10,26,7090,62500
10/27/87,284.5328082,1987,10,27,7920,70000
10/28/87,284.79903,1987,10,28,8750,77500
10/29/87,284.816517,1987,10,29,1300,7500
10/30/87,284.9131964,1987,10,30,1200,6666.7
10/31/87,284.7267493,1987,10,31,1100,5833.3
4/1/88,281.1503889,1988,4,1,1000,5000
4/2/88,281.2999175,1988,4,2,900,4166.7
4/3/88,281.3505518,1988,4,3,800,3333.3
4/4/88,281.3041948,1988,4,4,700,2500
4/5/88,281.2656263,1988,4,5,600,1666.7
4/6/88,281.2418343,1988,4,6,500,833.3
4/7/88,280.6726731,1988,4,7,400,0
4/8/88,280.8277962,1988,4,8,450,0
4/9/88,280.829602,1988,4,9,429,1428.6
4/10/88,280.8244582,1988,4,10,407,2857.1
4/11/88,280.8549331,1988,4,11,386,4285.7
4/12/88,280.8613317,1988,4,12,364,5714.3
4/13/88,280.9557164,1988,4,13,343,7142.9
4/14/88,280.9923611,1988,4,14,321,8571.4
4/15/88,281.0308395,1988,4,15,300,10000
4/16/88,281.0445934,1988,4,16,21600,70000
4/17/88,281.0576887,1988,4,17,18383,62500
4/18/88,281.0690821,1988,4,18,15167,55000
4/19/88,281.5400526,1988,4,19,11950,47500
4/20/88,281.7650752,1988,4,20,8733,40000
4/21/88,281.7469677,1988,4,21,5517,32500
4/22/88,281.4925344,1988,4,22,2300,25000
4/23/88,281.5017615,1988,4,23,2218,24125
4/24/88,281.4259175,1988,4,24,2135,23250
4/25/88,281.4985171,1988,4,25,2053,22375
4/26/88,281.5543854,1988,4,26,1970,21500
4/27/88,282.1473559,1988,4,27,1888,20625
4/28/88,282.1633594,1988,4,28,1805,19750
4/29/88,281.9847285,1988,4,29,1723,18875
4/30/88,281.9750682,1988,4,30,1640,18000
5/1/88,281.876167,1988,5,1,1558,17125
5/2/88,281.705037,1988,5,2,1475,16250
5/3/88,281.6713975,1988,5,3,1393,15375
5/4/88,281.9108221,1988,5,4,1310,14500
5/5/88,281.9578897,1988,5,5,1228,13625
5/6/88,281.9719036,1988,5,6,1145,12750
5/7/88,282.1401843,1988,5,7,1063,11875
5/8/88,282.1853282,1988,5,8,980,11000
5/9/88,282.2777927,1988,5,9,898,10125
5/10/88,282.2726211,1988,5,10,815,9250
5/11/88,282.3712242,1988,5,11,733,8375
5/12/88,282.431446,1988,5,12,650,7500
5/13/88,282.4462433,1988,5,13,1850,2500
5/14/88,282.8144928,1988,5,14,16200,187500
5/15/88,282.6562744,1988,5,15,15339,177777.8
5/16/88,282.6547701,1988,5,16,14478,168055.6
5/17/88,282.7249226,1988,5,17,13617,158333.3
5/18/88,282.8408013,1988,5,18,12756,148611.1
5/19/88,282.8325275,1988,5,19,11894,138888.9
5/20/88,282.8685552,1988,5,20,11033,129166.7
5/21/88,282.892115,1988,5,21,10172,119444.4
5/22/88,282.9263126,1988,5,22,9311,109722.2
5/23/88,282.9334287,1988,5,23,8450,100000
5/24/88,283.0964269,1988,5,24,7589,90277.8
5/25/88,283.1299174,1988,5,25,6728,80555.6
5/26/88,283.3289399,1988,5,26,5867,70833.3
5/27/88,283.404472,1988,5,27,5006,61111.1
5/28/88,283.461654,1988,5,28,4144,51388.9
5/29/88,283.4363403,1988,5,29,3283,41666.7
5/30/88,283.4358758,1988,5,30,2422,31944.4
5/31/88,283.4325691,1988,5,31,1561,22222.2
6/1/88,283.4297268,1988,6,1,700,12500
6/2/88,283.458271,1988,6,2,689,13333.3
6/3/88,283.623751,1988,6,3,678,14166.7
6/4/88,283.7538481,1988,6,4,667,15000
6/5/88,283.9103541,1988,6,5,656,15833.3
6/6/88,283.9453073,1988,6,6,644,16666.7
6/7/88,284.0494911,1988,6,7,633,17500
6/8/88,283.9930197,1988,6,8,622,18333.3
6/9/88,284.1263853,1988,6,9,611,19166.7
6/10/88,284.1888567,1988,6,10,600,20000
6/11/88,284.2611202,1988,6,11,2450,2500
6/12/88,284.60216,1988,6,12,0,0
6/13/88,284.6704685,1988,6,13,10500,265000
6/14/88,284.3250092,1988,6,14,9742,243750
6/15/88,284.3649815,1988,6,15,8983,222500
6/16/88,284.4466626,1988,6,16,8225,201250
6/17/88,285.2509642,1988,6,17,7467,180000
6/18/88,285.426874,1988,6,18,6708,158750
6/19/88,285.3759832,1988,6,19,5950,137500
6/20/88,285.3588428,1988,6,20,5192,116250
6/21/88,285.3451444,1988,6,21,4433,95000
6/22/88,285.2735396,1988,6,22,3675,73750
6/23/88,285.253186,1988,6,23,2917,52500
6/24/88,285.6127596,1988,6,24,2158,31250
6/25/88,285.7484026,1988,6,25,1400,10000
6/26/88,285.5926522,1988,6,26,100,0
6/27/88,286.0519416,1988,6,27,113,0
6/28/88,286.0921981,1988,6,28,126,0
6/29/88,286.1189607,1988,6,29,139,0
6/30/88,286.1189087,1988,6,30,153,0
7/1/88,286.1244893,1988,7,1,166,0
7/2/88,286.1486071,1988,7,2,179,0
7/3/88,285.7311999,1988,7,3,192,0
7/4/88,285.8487388,1988,7,4,205,0
7/5/88,285.9674009,1988,7,5,218,0
7/6/88,285.7080248,1988,7,6,232,0
7/7/88,285.6587181,1988,7,7,245,0
7/8/88,285.658056,1988,7,8,258,0
7/9/88,285.65903,1988,7,9,271,0
7/10/88,285.691394,1988,7,10,284,0
7/11/88,285.6341739,1988,7,11,297,0
7/12/88,285.5852726,1988,7,12,311,0
7/13/88,285.729082,1988,7,13,324,0
7/14/88,285.8045413,1988,7,14,337,0
7/15/88,285.8169745,1988,7,15,350,0
7/16/88,285.8349711,1988,7,16,313,0
7/17/88,285.8468082,1988,7,17,275,0
7/18/88,285.853959,1988,7,18,238,0
7/19/88,285.8993142,1988,7,19,200,0
7/20/88,285.7420837,1988,7,20,163,0
7/21/88,285.6508775,1988,7,21,125,0
7/22/88,285.6811201,1988,7,22,88,0
7/23/88,286.2404095,1988,7,23,50,0
7/24/88,286.5045551,1988,7,24,988,10000
7/25/88,286.527647,1988,7,25,1925,20000
7/26/88,285.9465586,1988,7,26,2863,30000
7/27/88,286.1355257,1988,7,27,3800,40000
7/28/88,286.4024303,1988,7,28,350,2500
7/29/88,286.4494494,1988,7,29,900,12500
7/30/88,286.2669953,1988,7,30,838,11250
7/31/88,286.4008116,1988,7,31,775,10000
8/1/88,286.5218168,1988,8,1,713,8750
8/2/88,286.4959139,1988,8,2,650,7500
8/3/88,286.2521565,1988,8,3,588,6250
8/4/88,286.2763922,1988,8,4,525,5000
8/5/88,286.2856158,1988,8,5,463,3750
8/6/88,286.4654841,1988,8,6,400,2500
8/7/88,286.7853073,1988,8,7,381,4062.5
8/8/88,286.8222362,1988,8,8,363,5625
8/9/88,286.7613419,1988,8,9,344,7187.5
8/10/88,286.7785239,1988,8,10,325,8750
8/11/88,286.7324061,1988,8,11,306,10312.5
8/12/88,286.5563056,1988,8,12,288,11875
8/13/88,286.5203783,1988,8,13,269,13437.5
8/14/88,286.5319035,1988,8,14,250,15000
8/15/88,286.5635118,1988,8,15,308,14583.3
8/16/88,286.6218549,1988,8,16,367,14166.7
8/17/88,287.0055395,1988,8,17,425,13750
8/18/88,287.084874,1988,8,18,483,13333.3
8/19/88,287.0596158,1988,8,19,542,12916.7
8/20/88,287.0359624,1988,8,20,600,12500
8/21/88,286.7980213,1988,8,21,3125,18750
8/22/88,286.7485343,1988,8,22,5650,25000
8/23/88,286.7495153,1988,8,23,4842,24583.3
8/24/88,286.748569,1988,8,24,4033,24166.7
8/25/88,286.7372796,1988,8,25,3225,23750
8/26/88,286.7099208,1988,8,26,2417,23333.3
8/27/88,286.9565898,1988,8,27,1608,22916.7
8/28/88,286.962718,1988,8,28,800,22500
8/29/88,286.8069745,1988,8,29,450,12500
8/30/88,286.4679659,1988,8,30,225,6250
8/31/88,286.5202882,1988,8,31,0,0
9/1/88,286.5546418,1988,9,1,150,7500
9/2/88,286.5301704,1988,9,2,4625,67500
9/3/88,286.5050577,1988,9,3,9100,127500
9/4/88,286.5466002,1988,9,4,8404,118076.9
9/5/88,286.6122744,1988,9,5,7708,108653.8
9/6/88,286.5754979,1988,9,6,7012,99230.8
9/7/88,286.2277614,1988,9,7,6315,89807.7
9/8/88,286.0848255,1988,9,8,5619,80384.6
9/9/88,286.1013038,1988,9,9,4923,70961.5
9/10/88,286.1039589,1988,9,10,4227,61538.5
9/11/88,285.9940733,1988,9,11,3531,52115.4
9/12/88,286.1082328,1988,9,12,2835,42692.3
9/13/88,286.3364442,1988,9,13,2138,33269.2
9/14/88,286.3434563,1988,9,14,1442,23846.2
9/15/88,286.3046245,1988,9,15,746,14423.1
9/16/88,286.1051444,1988,9,16,50,5000
9/17/88,286.1723368,1988,9,17,150,10000
9/18/88,286.1740664,1988,9,18,0,2500
9/19/88,286.0626245,1988,9,19,1750,115000
9/20/88,285.9972726,1988,9,20,400,2500
9/21/88,286.3938723,1988,9,21,383,2395.8
9/22/88,286.4603957,1988,9,22,367,2291.7
9/23/88,286.4274147,1988,9,23,350,2187.5
9/24/88,285.8554425,1988,9,24,333,2083.3
9/25/88,285.7407215,1988,9,25,317,1979.2
9/26/88,285.7298376,1988,9,26,300,1875
9/27/88,285.4508567,1988,9,27,283,1770.8
9/28/88,285.356056,1988,9,28,267,1666.7
9/29/88,285.3590335,1988,9,29,250,1562.5
9/30/88,285.3497267,1988,9,30,233,1458.3
10/1/88,285.3403056,1988,10,1,217,1354.2
10/2/88,285.5014182,1988,10,2,200,1250
10/3/88,285.507439,1988,10,3,183,1145.8
10/4/88,285.4851687,1988,10,4,167,1041.7
10/5/88,285.4654564,1988,10,5,150,937.5
10/6/88,285.4454633,1988,10,6,133,833.3
10/7/88,285.3936262,1988,10,7,117,729.2
10/8/88,285.3625898,1988,10,8,100,625
10/9/88,285.3518792,1988,10,9,83,520.8
10/10/88,285.1794702,1988,10,10,67,416.7
10/11/88,285.1636643,1988,10,11,50,312.5
10/12/88,285.1596193,1988,10,12,33,208.3
10/13/88,285.1859659,1988,10,13,17,104.2
10/14/88,285.0825829,1988,10,14,0,0
10/15/88,285.0867735,1988,10,15,2450,15000
10/16/88,285.2320526,1988,10,16,3000,42500
10/17/88,285.0793662,1988,10,17,3550,70000
10/18/88,284.9847423,1988,10,18,0,5000
10/19/88,284.9357891,1988,10,19,636,8636.4
10/20/88,285.5538238,1988,10,20,1273,12272.7
10/21/88,285.5814078,1988,10,21,1909,15909.1
10/22/88,285.4731409,1988,10,22,2545,19545.5
10/23/88,285.4672033,1988,10,23,3182,23181.8
10/24/88,284.9964616,1988,10,24,3818,26818.2
10/25/88,285.0140352,1988,10,25,4455,30454.5
10/26/88,285.203907,1988,10,26,5091,34090.9
10/27/88,285.1590266,1988,10,27,5727,37727.3
10/28/88,285.1160768,1988,10,28,6364,41363.6
10/29/88,285.1353801,1988,10,29,7000,45000
10/30/88,284.904472,1988,10,30,800,27500
10/31/88,285.1142189,1988,10,31,767,34500
4/1/89,281.4339313,1989,4,1,733,41500
4/2/89,281.3695882,1989,4,2,700,48500
4/3/89,281.0952346,1989,4,3,667,55500
4/4/89,281.1127563,1989,4,4,633,62500
4/5/89,281.1039001,1989,4,5,600,69500
4/6/89,281.0937407,1989,4,6,567,76500
4/7/89,281.1052416,1989,4,7,533,83500
4/8/89,281.1175535,1989,4,8,500,90500
4/9/89,281.132732,1989,4,9,467,97500
4/10/89,281.3228256,1989,4,10,433,104500
4/11/89,281.309609,1989,4,11,400,111500
4/12/89,281.2281046,1989,4,12,367,118500
4/13/89,281.2099001,1989,4,13,333,125500
4/14/89,281.1893386,1989,4,14,300,132500
4/15/89,281.3061012,1989,4,15,3850,30000
4/16/89,281.2625344,1989,4,16,150,0
4/17/89,281.1804651,1989,4,17,188,0
4/18/89,281.34494,1989,4,18,225,0
4/19/89,281.5540249,1989,4,19,263,0
4/20/89,281.6953802,1989,4,20,300,0
4/21/89,281.9120769,1989,4,21,650,0
4/22/89,281.9432762,1989,4,22,0,0
4/23/89,281.6847597,1989,4,23,0,0
4/24/89,281.59155,1989,4,24,0,0
4/25/89,281.5163993,1989,4,25,0,0
4/26/89,281.4301462,1989,4,26,0,0
4/27/89,281.3236852,1989,4,27,0,0
4/28/89,281.3227459,1989,4,28,0,0
4/29/89,281.3203195,1989,4,29,0,0
4/30/89,281.3194842,1989,4,30,0,0
5/1/89,281.3172554,1989,5,1,4500,35000
5/2/89,281.3469227,1989,5,2,7300,34166.7
5/3/89,281.5088603,1989,5,3,10100,33333.3
5/4/89,282.145401,1989,5,4,12900,32500
5/5/89,282.155401,1989,5,5,11425,33750
5/6/89,282.0197476,1989,5,6,9950,35000
5/7/89,282.1267389,1989,5,7,8475,36250
5/8/89,282.2726939,1989,5,8,7000,37500
5/9/89,282.2373247,1989,5,9,5525,38750
5/10/89,282.658375,1989,5,10,4050,40000
5/11/89,282.7230023,1989,5,11,2575,41250
5/12/89,282.3519244,1989,5,12,1100,42500
5/13/89,282.3591306,1989,5,13,1233,43333.3
5/14/89,282.3526731,1989,5,14,1367,44166.7
5/15/89,282.1795743,1989,5,15,1500,45000
5/16/89,282.4695743,1989,5,16,0,0
5/17/89,282.513654,1989,5,17,37,108.7
5/18/89,282.3458758,1989,5,18,74,217.4
5/19/89,282.5093282,1989,5,19,111,326.1
5/20/89,282.52442,1989,5,20,148,434.8
5/21/89,282.6321427,1989,5,21,185,543.5
5/22/89,282.926732,1989,5,22,222,652.2
5/23/89,283.0055985,1989,5,23,259,760.9
5/24/89,282.9394287,1989,5,24,296,869.6
5/25/89,282.8865864,1989,5,25,333,978.3
5/26/89,282.9129989,1989,5,26,370,1087
5/27/89,283.0646731,1989,5,27,407,1195.7
5/28/89,283.6016054,1989,5,28,443,1304.3
5/29/89,283.1866176,1989,5,29,480,1413
5/30/89,283.1490266,1989,5,30,517,1521.7
5/31/89,283.1500041,1989,5,31,554,1630.4
6/1/89,283.406777,1989,6,1,591,1739.1
6/2/89,283.450673,1989,6,2,628,1847.8
6/3/89,284.0333975,1989,6,3,665,1956.5
6/4/89,283.9805725,1989,6,4,702,2065.2
6/5/89,283.7601254,1989,6,5,739,2173.9
6/6/89,283.8238203,1989,6,6,776,2282.6
6/7/89,283.8245794,1989,6,7,813,2391.3
6/8/89,284.6356505,1989,6,8,850,2500
6/9/89,284.6568845,1989,6,9,8300,130000
6/10/89,284.6225517,1989,6,10,8300,97500
6/11/89,284.5867597,1989,6,11,7667,82083.3
6/12/89,284.5804269,1989,6,12,7033,66666.7
6/13/89,284.9742952,1989,6,13,6400,51250
6/14/89,284.8051167,1989,6,14,5767,35833.3
6/15/89,284.6647597,1989,6,15,5133,20416.7
6/16/89,284.6667285,1989,6,16,4500,5000
6/17/89,286.2435985,1989,6,17,400,0
6/18/89,286.1126314,1989,6,18,635,192.3
6/19/89,286.1211132,1989,6,19,869,384.6
6/20/89,286.2471478,1989,6,20,1104,576.9
6/21/89,285.9734425,1989,6,21,1338,769.2
6/22/89,285.9758896,1989,6,22,1573,961.5
6/23/89,285.9949468,1989,6,23,1808,1153.8
6/24/89,286.0071375,1989,6,24,2042,1346.2
6/25/89,286.0186071,1989,6,25,2277,1538.5
6/26/89,286.0284789,1989,6,26,2512,1730.8
6/27/89,285.3651756,1989,6,27,2746,1923.1
6/28/89,285.3054876,1989,6,28,2981,2115.4
6/29/89,285.3709607,1989,6,29,3215,2307.7
6/30/89,285.3716331,1989,6,30,3450,2500
7/1/89,285.6466453,1989,7,1,2957,4285.7
7/2/89,285.6705863,1989,7,2,2464,6071.4
7/3/89,285.6615499,1989,7,3,1971,7857.1
7/4/89,286.571744,1989,7,4,1479,9642.9
7/5/89,286.7944407,1989,7,5,986,11428.6
7/6/89,286.7525517,1989,7,6,493,13214.3
7/7/89,286.9187319,1989,7,7,0,15000
7/8/89,286.9313003,1989,7,8,50,7500
7/9/89,286.2400768,1989,7,9,100,0
7/10/89,286.1944546,1989,7,10,3000,40000
7/11/89,285.9173732,1989,7,11,2250,30000
7/12/89,285.8974494,1989,7,12,1500,20000
7/13/89,285.9771756,1989,7,13,750,10000
7/14/89,285.9681669,1989,7,14,0,0
7/15/89,285.9656019,1989,7,15,98,12261.9
7/16/89,286.0720525,1989,7,16,195,24523.8
7/17/89,286.1430196,1989,7,17,293,36785.7
7/18/89,286.8606244,1989,7,18,390,49047.6
7/19/89,287.0963887,1989,7,19,488,61309.5
7/20/89,286.9852899,1989,7,20,586,73571.4
7/21/89,287.038666,1989,7,21,683,85833.3
7/22/89,287.733647,1989,7,22,781,98095.2
7/23/89,287.8775014,1989,7,23,879,110357.1
7/24/89,287.974822,1989,7,24,976,122619
7/25/89,288.0762431,1989,7,25,1074,134881
7/26/89,287.9262154,1989,7,26,1171,147142.9
7/27/89,287.8512587,1989,7,27,1269,159404.8
7/28/89,287.8598064,1989,7,28,1367,171666.7
7/29/89,287.537692,1989,7,29,1464,183928.6
7/30/89,287.4890126,1989,7,30,1562,196190.5
7/31/89,287.2798965,1989,7,31,1660,208452.4
8/1/89,287.1276296,1989,8,1,1757,220714.3
8/2/89,287.0256123,1989,8,2,1855,232976.2
8/3/89,287.0461392,1989,8,3,1952,245238.1
8/4/89,287.3000074,1989,8,4,2050,257500
8/5/89,287.6810958,1989,8,5,1367,171666.7
8/6/89,287.8283125,1989,8,6,683,85833.3
8/7/89,287.7827249,1989,8,7,0,0
8/8/89,287.7336366,1989,8,8,275,3750
8/9/89,287.7642501,1989,8,9,550,7500
8/10/89,287.7806279,1989,8,10,825,11250
8/11/89,287.9137891,1989,8,11,1100,15000
8/12/89,287.9531721,1989,8,12,978,13333.3
8/13/89,287.6952795,1989,8,13,856,11666.7
8/14/89,287.6982951,1989,8,14,733,10000
8/15/89,287.6392241,1989,8,15,611,8333.3
8/16/89,287.5660664,1989,8,16,489,6666.7
8/17/89,287.5226071,1989,8,17,367,5000
8/18/89,287.4130092,1989,8,18,244,3333.3
8/19/89,287.4151721,1989,8,19,122,1666.7
8/20/89,287.7750265,1989,8,20,0,0
8/21/89,287.2781288,1989,8,21,330,24500
8/22/89,287.2216435,1989,8,22,660,49000
8/23/89,287.1840248,1989,8,23,990,73500
8/24/89,287.2195984,1989,8,24,1320,98000
8/25/89,287.2141738,1989,8,25,1650,122500
8/26/89,287.2498237,1989,8,26,2281,136562.5
8/27/89,287.3005204,1989,8,27,2913,150625
8/28/89,287.3428255,1989,8,28,3544,164687.5
8/29/89,287.3540282,1989,8,29,4175,178750
8/30/89,287.580049,1989,8,30,4806,192812.5
8/31/89,287.6789572,1989,8,31,5438,206875
9/1/89,287.7269918,1989,9,1,6069,220937.5
9/2/89,287.6982986,1989,9,2,6700,235000
9/3/89,287.6712102,1989,9,3,6392,203333.3
9/4/89,287.5443922,1989,9,4,6083,171666.7
9/5/89,287.4843887,1989,9,5,5775,140000
9/6/89,287.3189884,1989,9,6,5467,108333.3
9/7/89,287.2795568,1989,9,7,5158,76666.7
9/8/89,287.3718549,1989,9,8,4850,45000
9/9/89,287.3147769,1989,9,9,4635,41538.5
9/10/89,287.1559555,1989,9,10,4419,38076.9
9/11/89,287.095283,1989,9,11,4204,34615.4
9/12/89,287.1403055,1989,9,12,3988,31153.8
9/13/89,287.0383575,1989,9,13,3773,27692.3
9/14/89,286.9924546,1989,9,14,3558,24230.8
9/15/89,286.8913558,1989,9,15,3342,20769.2
9/16/89,286.9459451,1989,9,16,3127,17307.7
9/17/89,286.9742605,1989,9,17,2912,13846.2
9/18/89,286.757231,1989,9,18,2696,10384.6
9/19/89,286.7568012,1989,9,19,2481,6923.1
9/20/89,286.6894182,1989,9,20,2265,3461.5
9/21/89,286.6393558,1989,9,21,2050,0
9/22/89,286.7010231,1989,9,22,1367,0
9/23/89,286.7846938,1989,9,23,683,0
9/24/89,286.9345482,1989,9,24,0,0
9/25/89,286.9817752,1989,9,25,50,25000
9/26/89,286.9373107,1989,9,26,5530,37000
9/27/89,286.9433627,1989,9,27,11010,49000
9/28/89,286.9299589,1989,9,28,16490,61000
9/29/89,286.8236123,1989,9,29,21970,73000
9/30/89,286.7624095,1989,9,30,27450,85000
10/1/89,286.7267007,1989,10,1,50,0
10/2/89,286.6955222,1989,10,2,650,5000
10/3/89,286.6550751,1989,10,3,1250,10000
10/4/89,286.6185274,1989,10,4,1850,15000
10/5/89,286.5428324,1989,10,5,2450,20000
10/6/89,286.5134945,1989,10,6,3050,25000
10/7/89,286.4974494,1989,10,7,3650,30000
10/8/89,286.4810127,1989,10,8,2920,24500
10/9/89,286.4659555,1989,10,9,2190,19000
10/10/89,286.4517926,1989,10,10,1460,13500
10/11/89,286.4383991,1989,10,11,730,8000
10/12/89,286.4263264,1989,10,12,0,2500
10/13/89,286.4793558,1989,10,13,75,1250
10/14/89,286.5016227,1989,10,14,150,0
10/15/89,286.3882674,1989,10,15,400,0
10/16/89,286.3599971,1989,10,16,267,0
10/17/89,286.3394563,1989,10,17,133,0
10/18/89,286.3194806,1989,10,18,0,0
10/19/89,286.3539139,1989,10,19,0,0
10/20/89,286.356316,1989,10,20,0,0
10/21/89,286.3909988,1989,10,21,0,0
10/22/89,286.289803,1989,10,22,0,0
10/23/89,286.1771201,1989,10,23,0,0
10/24/89,286.1801531,1989,10,24,0,0
10/25/89,286.1621392,1989,10,25,0,0
10/26/89,285.8925933,1989,10,26,0,0
10/27/89,285.7797579,1989,10,27,0,0
10/28/89,285.7807215,1989,10,28,0,0
10/29/89,285.7236123,1989,10,29,0,0
10/30/89,285.702569,1989,10,30,600,0
10/31/89,285.6927735,1989,10,31,531,312.5
4/1/90,281.3377961,1990,4,1,463,625
4/2/90,281.3461462,1990,4,2,394,937.5
4/3/90,281.3170301,1990,4,3,325,1250
4/4/90,281.2797684,1990,4,4,256,1562.5
4/5/90,281.2616402,1990,4,5,188,1875
4/6/90,281.1295604,1990,4,6,119,2187.5
4/7/90,281.6628811,1990,4,7,50,2500
4/8/90,281.9633178,1990,4,8,64,2142.9
4/9/90,282.0116436,1990,4,9,79,1785.7
4/10/90,281.9649538,1990,4,10,93,1428.6
4/11/90,281.7721635,1990,4,11,107,1071.4
4/12/90,281.7952589,1990,4,12,121,714.3
4/13/90,281.7807667,1990,4,13,136,357.1
4/14/90,281.754167,1990,4,14,150,0
4/15/90,281.703193,1990,4,15,3800,15000
4/16/90,281.633706,1990,4,16,1975,7500
4/17/90,281.7116713,1990,4,17,150,0
4/18/90,281.7200457,1990,4,18,238,1250
4/19/90,281.5200804,1990,4,19,325,2500
4/20/90,281.5049053,1990,4,20,413,3750
4/21/90,281.500576,1990,4,21,500,5000
4/22/90,281.3900284,1990,4,22,560,8500
4/23/90,281.6263923,1990,4,23,620,12000
4/24/90,281.6589504,1990,4,24,680,15500
4/25/90,281.6706384,1990,4,25,740,19000
4/26/90,281.6992901,1990,4,26,800,22500
4/27/90,281.5973317,1990,4,27,778,28055.6
4/28/90,281.5619937,1990,4,28,756,33611.1
4/29/90,281.6746627,1990,4,29,733,39166.7
4/30/90,282.270992,1990,4,30,711,44722.2
5/1/90,282.2703646,1990,5,1,689,50277.8
5/2/90,282.331602,1990,5,2,667,55833.3
5/3/90,282.8639278,1990,5,3,644,61388.9
5/4/90,283.1882259,1990,5,4,622,66944.4
5/5/90,283.7433316,1990,5,5,600,72500
5/6/90,283.7147077,1990,5,6,540,58000
5/7/90,283.628933,1990,5,7,480,43500
5/8/90,283.3984547,1990,5,8,420,29000
5/9/90,283.1784616,1990,5,9,360,14500
5/10/90,283.6100006,1990,5,10,300,0
5/11/90,283.7360561,1990,5,11,2975,27500
5/12/90,283.6948325,1990,5,12,5650,55000
5/13/90,283.7982363,1990,5,13,5022,49166.7
5/14/90,283.8159555,1990,5,14,4394,43333.3
5/15/90,283.8158793,1990,5,15,3767,37500
5/16/90,283.8933524,1990,5,16,3139,31666.7
5/17/90,284.082725,1990,5,17,2511,25833.3
5/18/90,284.236011,1990,5,18,1883,20000
5/19/90,284.2392103,1990,5,19,1256,14166.7
5/20/90,284.7949087,1990,5,20,628,8333.3
5/21/90,284.6735638,1990,5,21,0,2500
5/22/90,284.6100595,1990,5,22,50,2083.3
5/23/90,284.6668221,1990,5,23,100,1666.7
5/24/90,284.5929711,1990,5,24,150,1250
5/25/90,284.631855,1990,5,25,200,833.3
5/26/90,284.5191028,1990,5,26,250,416.7
5/27/90,284.6471271,1990,5,27,300,0
5/28/90,285.0062397,1990,5,28,14400,62500
5/29/90,285.0298758,1990,5,29,15000,58750
5/30/90,286.0318064,1990,5,30,15600,55000
5/31/90,286.1102813,1990,5,31,16200,51250
6/1/90,285.537848,1990,6,1,16800,47500
6/2/90,285.4434772,1990,6,2,15163,41562.5
6/3/90,285.4295361,1990,6,3,13525,35625
6/4/90,285.423498,1990,6,4,11888,29687.5
6/5/90,285.4158827,1990,6,5,10250,23750
6/6/90,285.4079139,1990,6,6,8613,17812.5
6/7/90,285.3994009,1990,6,7,6975,11875
6/8/90,285.3906695,1990,6,8,5338,5937.5
6/9/90,285.3817683,1990,6,9,3700,0
6/10/90,285.3726869,1990,6,10,2550,4166.7
6/11/90,285.3636851,1990,6,11,1400,8333.3
6/12/90,285.3548532,1990,6,12,250,12500
6/13/90,285.3302917,1990,6,13,1300,10500
6/14/90,284.949647,1990,6,14,2350,8500
6/15/90,284.9162189,1990,6,15,3400,6500
6/16/90,284.9097129,1990,6,16,4450,4500
6/17/90,285.6867077,1990,6,17,5500,2500
6/18/90,285.9409745,1990,6,18,5600,12500
6/19/90,285.8730092,1990,6,19,6538,25625
6/20/90,285.7521739,1990,6,20,7475,38750
6/21/90,286.1760872,1990,6,21,8413,51875
6/22/90,286.2034633,1990,6,22,9350,65000
6/23/90,285.9307007,1990,6,23,8682,60357.1
6/24/90,285.8439659,1990,6,24,8014,55714.3
6/25/90,285.6593905,1990,6,25,7346,51071.4
6/26/90,285.6051305,1990,6,26,6679,46428.6
6/27/90,285.8411479,1990,6,27,6011,41785.7
6/28/90,285.8618203,1990,6,28,5343,37142.9
6/29/90,285.8545794,1990,6,29,4675,32500
6/30/90,285.8605517,1990,6,30,4007,27857.1
7/1/90,285.7567908,1990,7,1,3339,23214.3
7/2/90,285.6493489,1990,7,2,2671,18571.4
7/3/90,285.7204616,1990,7,3,2004,13928.6
7/4/90,285.7507077,1990,7,4,1336,9285.7
7/5/90,285.7928324,1990,7,5,668,4642.9
7/6/90,285.8308359,1990,7,6,0,0
7/7/90,285.8034702,1990,7,7,450,5000
7/8/90,285.7792172,1990,7,8,370,7500
7/9/90,285.6788948,1990,7,9,290,10000
7/10/90,285.6406071,1990,7,10,210,12500
7/11/90,285.6512103,1990,7,11,130,15000
7/12/90,285.6506349,1990,7,12,50,17500
7/13/90,286.0876886,1990,7,13,267,20000
7/14/90,286.2704095,1990,7,14,483,22500
7/15/90,286.2826799,1990,7,15,700,25000
7/16/90,287.0434494,1990,7,16,533,16666.7
7/17/90,287.0542293,1990,7,17,367,8333.3
7/18/90,286.9220179,1990,7,18,200,0
7/19/90,286.9150993,1990,7,19,753,2031.3
7/20/90,286.8315222,1990,7,20,1306,4062.5
7/21/90,287.2464511,1990,7,21,1859,6093.8
7/22/90,287.0583853,1990,7,22,2413,8125
7/23/90,286.8650438,1990,7,23,2966,10156.3
7/24/90,286.8664269,1990,7,24,3519,12187.5
7/25/90,286.9496331,1990,7,25,4072,14218.8
7/26/90,287.5401738,1990,7,26,4625,16250
7/27/90,287.6413835,1990,7,27,5178,18281.3
7/28/90,287.7207249,1990,7,28,5731,20312.5
7/29/90,287.7233835,1990,7,29,6284,22343.8
7/30/90,287.676718,1990,7,30,6838,24375
7/31/90,287.6711166,1990,7,31,7391,26406.3
8/1/90,287.9022674,1990,8,1,7944,28437.5
8/2/90,288.0275395,1990,8,2,8497,30468.8
8/3/90,288.0575811,1990,8,3,9050,32500
8/4/90,288.0422327,1990,8,4,4950,2500
8/5/90,288.0248463,1990,8,5,350,0
8/6/90,287.9894286,1990,8,6,321,2500
8/7/90,287.9426868,1990,8,7,293,5000
8/8/90,287.9394112,1990,8,8,264,7500
8/9/90,288.3954632,1990,8,9,236,10000
8/10/90,288.5428844,1990,8,10,207,12500
8/11/90,288.5061079,1990,8,11,179,15000
8/12/90,288.4543714,1990,8,12,150,17500
8/13/90,288.416562,1990,8,13,1350,15000
8/14/90,288.2345897,1990,8,14,675,7500
8/15/90,288.111387,1990,8,15,0,0
8/16/90,287.993595,1990,8,16,175,1250
8/17/90,287.5991998,1990,8,17,350,2500
8/18/90,287.5649849,1990,8,18,525,3750
8/19/90,287.5334182,1990,8,19,700,5000
8/20/90,287.4567215,1990,8,20,875,6250
8/21/90,287.3929364,1990,8,21,1050,7500
8/22/90,287.3876262,1990,8,22,1225,8750
8/23/90,287.3771201,1990,8,23,1400,10000
8/24/90,287.3752137,1990,8,24,1575,11250
8/25/90,287.3850265,1990,8,25,1750,12500
8/26/90,287.3842986,1990,8,26,1925,13750
8/27/90,287.3684511,1990,8,27,2100,15000
8/28/90,287.8377544,1990,8,28,1675,12500
8/29/90,287.8954008,1990,8,29,1250,10000
8/30/90,287.8816781,1990,8,30,825,7500
8/31/90,287.7142085,1990,8,31,400,5000
9/1/90,287.6915187,1990,9,1,2150,22500
9/2/90,287.3186972,1990,9,2,1917,20000
9/3/90,287.2977059,1990,9,3,1683,17500
9/4/90,287.2832657,1990,9,4,1450,15000
9/5/90,287.430621,1990,9,5,1217,12500
9/6/90,287.3369295,1990,9,6,983,10000
9/7/90,287.2990369,1990,9,7,750,7500
9/8/90,287.2680456,1990,9,8,517,5000
9/9/90,287.2219866,1990,9,9,283,2500
9/10/90,287.3192483,1990,9,10,50,0
9/11/90,287.3127457,1990,9,11,33,29166.7
9/12/90,287.5396608,1990,9,12,17,58333.3
9/13/90,287.526718,1990,9,13,0,87500
9/14/90,287.418874,1990,9,14,0,58333.3
9/15/90,287.3233315,1990,9,15,0,29166.7
9/16/90,287.3034736,1990,9,16,0,0
9/17/90,287.2437336,1990,9,17,1000,5000
9/18/90,287.2354494,1990,9,18,763,4375
9/19/90,287.2219936,1990,9,19,525,3750
9/20/90,287.2054321,1990,9,20,288,3125
9/21/90,287.1881114,1990,9,21,50,2500
9/22/90,287.0537925,1990,9,22,1900,3333.3
9/23/90,286.8185135,1990,9,23,3750,4166.7
9/24/90,286.5635049,1990,9,24,5600,5000
9/25/90,286.6289329,1990,9,25,5269,5000
9/26/90,286.6191825,1990,9,26,4938,5000
9/27/90,286.5089121,1990,9,27,4606,5000
9/28/90,286.4762016,1990,9,28,4275,5000
9/29/90,286.4847596,1990,9,29,3944,5000
9/30/90,286.6734251,1990,9,30,3613,5000
10/1/90,286.7255014,1990,10,1,3281,5000
10/2/90,286.6745794,1990,10,2,2950,5000
10/3/90,286.558205,1990,10,3,2619,5000
10/4/90,286.5014563,1990,10,4,2288,5000
10/5/90,286.4650023,1990,10,5,1956,5000
10/6/90,286.4473073,1990,10,6,1625,5000
10/7/90,286.3819139,1990,10,7,1294,5000
10/8/90,286.3674286,1990,10,8,963,5000
10/9/90,286.3854979,1990,10,9,631,5000
10/10/90,286.4571097,1990,10,10,300,5000
10/11/90,286.4657787,1990,10,11,317,3333.3
10/12/90,286.3634182,1990,10,12,333,1666.7
10/13/90,286.3354009,1990,10,13,350,0
10/14/90,286.2957856,1990,10,14,300,833.3
10/15/90,286.3343264,1990,10,15,250,1666.7
10/16/90,286.4244511,1990,10,16,200,2500
10/17/90,286.4582605,1990,10,17,185,2250
10/18/90,286.4105725,1990,10,18,170,2000
10/19/90,286.3713662,1990,10,19,155,1750
10/20/90,286.306205,1990,10,20,140,1500
10/21/90,286.2190681,1990,10,21,125,1250
10/22/90,286.1814667,1990,10,22,110,1000
10/23/90,285.8640317,1990,10,23,95,750
10/24/90,285.7798307,1990,10,24,80,500
10/25/90,285.7881773,1990,10,25,65,250
10/26/90,285.9557891,1990,10,26,50,0
10/27/90,285.9611998,1990,10,27,7400,7500
10/28/90,285.940205,1990,10,28,350,2500
10/29/90,285.9158168,1990,10,29,489,2222.2
10/30/90,285.868056,1990,10,30,628,1944.4
10/31/90,285.8214044,1990,10,31,767,1666.7
4/1/91,280.8295639,1991,4,1,906,1388.9
4/2/91,281.0638031,1991,4,2,1044,1111.1
4/3/91,281.2052658,1991,4,3,1183,833.3
4/4/91,281.3442086,1991,4,4,1322,555.6
4/5/91,281.3213871,1991,4,5,1461,277.8
4/6/91,281.2844027,1991,4,6,1600,0
4/7/91,280.8504617,1991,4,7,1342,3333.3
4/8/91,280.7339001,1991,4,8,1083,6666.7
4/9/91,280.7357615,1991,4,9,825,10000
4/10/91,280.7440908,1991,4,10,567,13333.3
4/11/91,280.9723438,1991,4,11,308,16666.7
4/12/91,280.8311826,1991,4,12,50,20000
4/13/91,280.7441081,1991,4,13,6900,37500
4/14/91,280.8673386,1991,4,14,3100,2500
4/15/91,280.972323,1991,4,15,2800,3125
4/16/91,281.0623577,1991,4,16,2500,3750
4/17/91,281.0845656,1991,4,17,2200,4375
4/18/91,281.0293837,1991,4,18,1900,5000
4/19/91,280.9708984,1991,4,19,3463,6875
4/20/91,280.9314391,1991,4,20,5025,8750
4/21/91,280.8904097,1991,4,21,6588,10625
4/22/91,281.05355,1991,4,22,8150,12500
4/23/91,281.0717442,1991,4,23,7663,11718.8
4/24/91,281.0658169,1991,4,24,7175,10937.5
4/25/91,281.5858204,1991,4,25,6688,10156.3
4/26/91,281.6177857,1991,4,26,6200,9375
4/27/91,281.3870509,1991,4,27,5713,8593.8
4/28/91,281.3395743,1991,4,28,5225,7812.5
4/29/91,281.3256124,1991,4,29,4738,7031.3
4/30/91,280.9708395,1991,4,30,4250,6250
5/1/91,281.0487771,1991,5,1,3763,5468.8
5/2/91,281.081349,1991,5,2,3275,4687.5
5/3/91,281.1355431,1991,5,3,2788,3906.3
5/4/91,281.4637476,1991,5,4,2300,3125
5/5/91,281.4958967,1991,5,5,1813,2343.8
5/6/91,281.5033802,1991,5,6,1325,1562.5
5/7/91,281.5462017,1991,5,7,838,781.3
5/8/91,281.5787528,1991,5,8,350,0
5/9/91,281.4851826,1991,5,9,8900,117500
5/10/91,281.8110058,1991,5,10,17450,235000
5/11/91,281.857245,1991,5,11,26000,352500
5/12/91,281.8814356,1991,5,12,17350,235000
5/13/91,281.8151999,1991,5,13,8700,117500
5/14/91,281.8137441,1991,5,14,50,0
5/15/91,281.6800977,1991,5,15,350,5625
5/16/91,281.8294287,1991,5,16,650,11250
5/17/91,281.8788221,1991,5,17,950,16875
5/18/91,281.9051687,1991,5,18,1250,22500
5/19/91,281.9238828,1991,5,19,300,0
5/20/91,281.940531,1991,5,20,1850,22500
5/21/91,281.9514044,1991,5,21,1675,18750
5/22/91,281.9564686,1991,5,22,1500,15000
5/23/91,281.9599521,1991,5,23,1325,11250
5/24/91,281.9627493,1991,5,24,1150,7500
5/25/91,281.9649088,1991,5,25,1950,5000
5/26/91,282.1326141,1991,5,26,2096,5192.3
5/27/91,282.6058377,1991,5,27,2242,5384.6
5/28/91,282.7985656,1991,5,28,2388,5576.9
5/29/91,283.7936921,1991,5,29,2535,5769.2
5/30/91,283.7941774,1991,5,30,2681,5961.5
5/31/91,283.915959,1991,5,31,2827,6153.8
6/1/91,284.218167,1991,6,1,2973,6346.2
6/2/91,283.8271514,1991,6,2,3119,6538.5
6/3/91,283.7849538,1991,6,3,3265,6730.8
6/4/91,283.9621323,1991,6,4,3412,6923.1
6/5/91,283.9135846,1991,6,5,3558,7115.4
6/6/91,283.8354703,1991,6,6,3704,7307.7
6/7/91,284.0113316,1991,6,7,3850,7500
6/8/91,284.0305448,1991,6,8,4200,27500
6/9/91,284.063647,1991,6,9,4207,32500
6/10/91,283.7734876,1991,6,10,4214,37500
6/11/91,283.7123611,1991,6,11,4221,42500
6/12/91,283.7851895,1991,6,12,4229,47500
6/13/91,283.757855,1991,6,13,4236,52500
6/14/91,283.7607944,1991,6,14,4243,57500
6/15/91,283.775394,1991,6,15,4250,62500
6/16/91,283.7831791,1991,6,16,2050,0
6/17/91,283.7892866,1991,6,17,5367,1666.7
6/18/91,283.7951236,1991,6,18,8683,3333.3
6/19/91,283.8980872,1991,6,19,12000,5000
6/20/91,284.1038342,1991,6,20,11232,5892.9
6/21/91,284.3018862,1991,6,21,10464,6785.7
6/22/91,284.4200214,1991,6,22,9696,7678.6
6/23/91,284.8347701,1991,6,23,8929,8571.4
6/24/91,285.0567562,1991,6,24,8161,9464.3
6/25/91,284.9435361,1991,6,25,7393,10357.1
6/26/91,285.1506071,1991,6,26,6625,11250
6/27/91,285.649335,1991,6,27,5857,12142.9
6/28/91,285.8243957,1991,6,28,5089,13035.7
6/29/91,285.5890716,1991,6,29,4321,13928.6
6/30/91,285.6301669,1991,6,30,3554,14821.4
7/1/91,286.2561773,1991,7,1,2786,15714.3
7/2/91,286.7142016,1991,7,2,2018,16607.1
7/3/91,286.5773731,1991,7,3,1250,17500
7/4/91,286.3902986,1991,7,4,4600,2500
7/5/91,286.302822,1991,7,5,2600,2500
7/6/91,285.9678619,1991,7,6,600,2500
7/7/91,286.0207076,1991,7,7,475,1250
7/8/91,285.9964581,1991,7,8,350,0
7/9/91,286.4629884,1991,7,9,1050,0
7/10/91,286.5547284,1991,7,10,1750,0
7/11/91,286.5604789,1991,7,11,1575,1250
7/12/91,286.6516678,1991,7,12,1400,2500
7/13/91,286.7287562,1991,7,13,1225,3750
7/14/91,286.7340387,1991,7,14,1050,5000
7/15/91,286.7368082,1991,7,15,991,4705.9
7/16/91,286.7462466,1991,7,16,932,4411.8
7/17/91,286.7432657,1991,7,17,874,4117.6
7/18/91,286.7650404,1991,7,18,815,3823.5
7/19/91,286.7802085,1991,7,19,756,3529.4
7/20/91,287.0468047,1991,7,20,697,3235.3
7/21/91,287.1481808,1991,7,21,638,2941.2
7/22/91,286.8855187,1991,7,22,579,2647.1
7/23/91,286.9076366,1991,7,23,521,2352.9
7/24/91,287.2133627,1991,7,24,462,2058.8
7/25/91,287.2780837,1991,7,25,403,1764.7
7/26/91,287.2687319,1991,7,26,344,1470.6
7/27/91,287.2605378,1991,7,27,285,1176.5
7/28/91,287.1455152,1991,7,28,226,882.4
7/29/91,287.4234702,1991,7,29,168,588.2
7/30/91,287.4430854,1991,7,30,109,294.1
7/31/91,287.5344269,1991,7,31,50,0
8/1/91,287.5626695,1991,8,1,4050,20000
8/2/91,287.6800837,1991,8,2,2150,7500
8/3/91,287.7944407,1991,8,3,550,17500
8/4/91,287.8129953,1991,8,4,413,13125
8/5/91,287.7782535,1991,8,5,275,8750
8/6/91,287.89251,1991,8,6,138,4375
8/7/91,287.8761045,1991,8,7,0,0
8/8/91,287.5756678,1991,8,8,100,2500
8/9/91,287.6059832,1991,8,9,93,2142.9
8/10/91,287.6080872,1991,8,10,86,1785.7
8/11/91,287.5938723,1991,8,11,79,1428.6
8/12/91,287.6442813,1991,8,12,71,1071.4
8/13/91,287.5679069,1991,8,13,64,714.3
8/14/91,287.5596366,1991,8,14,57,357.1
8/15/91,287.5420456,1991,8,15,50,0
8/16/91,287.5216054,1991,8,16,56,14687.5
8/17/91,287.4667769,1991,8,17,63,29375
8/18/91,287.458621,1991,8,18,69,44062.5
8/19/91,287.530101,1991,8,19,75,58750
8/20/91,287.4859832,1991,8,20,81,73437.5
8/21/91,287.4617475,1991,8,21,88,88125
8/22/91,287.4312553,1991,8,22,94,102812.5
8/23/91,287.8125447,1991,8,23,100,117500
8/24/91,287.9466244,1991,8,24,106,132187.5
8/25/91,288.000361,1991,8,25,113,146875
8/26/91,288.0104962,1991,8,26,119,161562.5
8/27/91,287.9751929,1991,8,27,125,176250
8/28/91,287.8743471,1991,8,28,131,190937.5
8/29/91,287.7766106,1991,8,29,138,205625
8/30/91,287.9733523,1991,8,30,144,220312.5
8/31/91,288.3194875,1991,8,31,150,235000
9/1/91,288.3673211,1991,9,1,283,237916.7
9/2/91,288.3888012,1991,9,2,417,240833.3
9/3/91,288.3362605,1991,9,3,550,243750
9/4/91,288.2617371,1991,9,4,683,246666.7
9/5/91,288.2845378,1991,9,5,817,249583.3
9/6/91,288.2369052,1991,9,6,950,252500
9/7/91,288.2165031,1991,9,7,800,92500
9/8/91,288.1820802,1991,9,8,917,98750
9/9/91,288.216153,1991,9,9,1033,105000
9/10/91,288.088049,1991,9,10,1150,111250
9/11/91,288.2058376,1991,9,11,1267,117500
9/12/91,288.2078064,1991,9,12,1383,123750
9/13/91,288.0871859,1991,9,13,1500,130000
9/14/91,287.8553593,1991,9,14,1617,136250
9/15/91,287.7445932,1991,9,15,1733,142500
9/16/91,287.6889294,1991,9,16,1850,148750
9/17/91,287.6741253,1991,9,17,1967,155000
9/18/91,287.5583714,1991,9,18,2083,161250
9/19/91,287.5590334,1991,9,19,2200,167500
9/20/91,287.6043749,1991,9,20,2317,173750
9/21/91,287.5106487,1991,9,21,2433,180000
9/22/91,287.5427596,1991,9,22,2550,186250
9/23/91,287.5436366,1991,9,23,2667,192500
9/24/91,287.4589988,1991,9,24,2783,198750
9/25/91,287.4075014,1991,9,25,2900,205000
9/26/91,287.4278237,1991,9,26,2583,182222.2
9/27/91,287.3845516,1991,9,27,2267,159444.4
9/28/91,287.2842431,1991,9,28,1950,136666.7
9/29/91,287.3860733,1991,9,29,1633,113888.9
9/30/91,287.4155083,1991,9,30,1317,91111.1
10/1/91,287.3789988,1991,10,1,1000,68333.3
10/2/91,286.8955257,1991,10,2,683,45555.6
10/3/91,286.8222882,1991,10,3,367,22777.8
10/4/91,286.7941877,1991,10,4,50,0
10/5/91,286.697231,1991,10,5,50,0
10/6/91,286.5292241,1991,10,6,50,0
10/7/91,286.4571721,1991,10,7,600,12500
10/8/91,286.4635811,1991,10,8,565,11764.7
10/9/91,286.4598134,1991,10,9,529,11029.4
10/10/91,286.446614,1991,10,10,494,10294.1
10/11/91,286.4174425,1991,10,11,459,9558.8
10/12/91,286.4024511,1991,10,12,424,8823.5
10/13/91,286.385543,1991,10,13,388,8088.2
10/14/91,286.2738654,1991,10,14,353,7352.9
10/15/91,286.2492137,1991,10,15,318,6617.6
10/16/91,286.2338307,1991,10,16,282,5882.4
10/17/91,286.2111894,1991,10,17,247,5147.1
10/18/91,286.1671583,1991,10,18,212,4411.8
10/19/91,286.1464096,1991,10,19,176,3676.5
10/20/91,286.1309364,1991,10,20,141,2941.2
10/21/91,285.5217475,1991,10,21,106,2205.9
10/22/91,285.38616,1991,10,22,71,1470.6
10/23/91,285.2601739,1991,10,23,35,735.3
10/24/91,285.2000456,1991,10,24,0,0
10/25/91,285.2026002,1991,10,25,4775,68750
10/26/91,285.1948498,1991,10,26,9550,137500
10/27/91,285.1755188,1991,10,27,2950,5000
10/28/91,285.1587735,1991,10,28,2492,4166.7
10/29/91,285.1520179,1991,10,29,2033,3333.3
10/30/91,285.1228047,1991,10,30,1575,2500
10/31/91,285.0869746,1991,10,31,1117,1666.7
4/1/92,281.1048291,1992,4,1,658,833.3
4/2/92,280.9479487,1992,4,2,200,0
4/3/92,280.8789019,1992,4,3,100,0
4/4/92,280.9147424,1992,4,4,0,0
4/5/92,280.925966,1992,4,5,43,0
4/6/92,280.7507424,1992,4,6,86,0
4/7/92,280.7331514,1992,4,7,129,0
4/8/92,280.6627667,1992,4,8,171,0
4/9/92,280.5976575,1992,4,9,214,0
4/10/92,280.6441982,1992,4,10,257,0
4/11/92,280.8197372,1992,4,11,300,0
4/12/92,280.8581982,1992,4,12,225,1250
4/13/92,280.9003473,1992,4,13,150,2500
4/14/92,281.2230856,1992,4,14,197,2916.7
4/15/92,281.3657823,1992,4,15,244,3333.3
4/16/92,281.2164201,1992,4,16,292,3750
4/17/92,281.2097372,1992,4,17,339,4166.7
4/18/92,281.2412034,1992,4,18,386,4583.3
4/19/92,281.2431029,1992,4,19,433,5000
4/20/92,281.2313282,1992,4,20,481,5416.7
4/21/92,281.2579383,1992,4,21,528,5833.3
4/22/92,281.2916298,1992,4,22,575,6250
4/23/92,281.2905726,1992,4,23,622,6666.7
4/24/92,281.1244859,1992,4,24,669,7083.3
4/25/92,281.0912693,1992,4,25,717,7500
4/26/92,281.1598273,1992,4,26,764,7916.7
4/27/92,281.2708221,1992,4,27,811,8333.3
4/28/92,281.3390162,1992,4,28,858,8750
4/29/92,281.3738239,1992,4,29,906,9166.7
4/30/92,281.368018,1992,4,30,953,9583.3
5/1/92,281.3610474,1992,5,1,1000,10000
5/2/92,281.6019868,1992,5,2,7900,27500
5/3/92,281.7152415,1992,5,3,5200,18750
5/4/92,281.7053767,1992,5,4,2500,10000
5/5/92,281.8134079,1992,5,5,2388,8750
5/6/92,281.8547077,1992,5,6,2275,7500
5/7/92,281.7872207,1992,5,7,2163,6250
5/8/92,281.7931202,1992,5,8,2050,5000
5/9/92,282.1069712,1992,5,9,200,5000
5/10/92,282.1323923,1992,5,10,150,0
5/11/92,282.0120977,1992,5,11,763,5625
5/12/92,282.0127008,1992,5,12,1375,11250
5/13/92,282.0855708,1992,5,13,1988,16875
5/14/92,282.2471653,1992,5,14,2600,22500
5/15/92,282.18894,1992,5,15,2578,23043.5
5/16/92,282.3091237,1992,5,16,2557,23587
5/17/92,282.2838238,1992,5,17,2535,24130.4
5/18/92,282.8165101,1992,5,18,2513,24673.9
5/19/92,282.8689815,1992,5,19,2491,25217.4
5/20/92,282.8665136,1992,5,20,2470,25760.9
5/21/92,282.998212,1992,5,21,2448,26304.3
5/22/92,283.0054218,1992,5,22,2426,26847.8
5/23/92,283.2990682,1992,5,23,2404,27391.3
5/24/92,283.3941531,1992,5,24,2383,27934.8
5/25/92,283.3599001,1992,5,25,2361,28478.3
5/26/92,283.7064373,1992,5,26,2339,29021.7
5/27/92,283.9314633,1992,5,27,2317,29565.2
5/28/92,283.7385101,1992,5,28,2296,30108.7
5/29/92,283.7683923,1992,5,29,2274,30652.2
5/30/92,284.0194876,1992,5,30,2252,31195.7
5/31/92,284.110517,1992,5,31,2230,31739.1
6/1/92,284.2104685,1992,6,1,2209,32282.6
6/2/92,284.2527285,1992,6,2,2187,32826.1
6/3/92,284.2083125,1992,6,3,2165,33369.6
6/4/92,284.2777129,1992,6,4,2143,33913
6/5/92,284.3907493,1992,6,5,2122,34456.5
6/6/92,284.9004581,1992,6,6,2100,35000
6/7/92,284.840108,1992,6,7,7200,30000
6/8/92,284.777907,1992,6,8,3625,15000
6/9/92,284.7685413,1992,6,9,50,0
6/10/92,285.0177857,1992,6,10,0,0
6/11/92,285.2615569,1992,6,11,292,416.7
6/12/92,285.2924338,1992,6,12,583,833.3
6/13/92,285.4323125,1992,6,13,875,1250
6/14/92,285.4875326,1992,6,14,1167,1666.7
6/15/92,285.4163333,1992,6,15,1458,2083.3
6/16/92,285.6914979,1992,6,16,1750,2500
6/17/92,285.7274252,1992,6,17,1800,3194.4
6/18/92,285.6146522,1992,6,18,1850,3888.9
6/19/92,285.5654806,1992,6,19,1900,4583.3
6/20/92,285.5234876,1992,6,20,1950,5277.8
6/21/92,285.5445482,1992,6,21,2000,5972.2
6/22/92,285.5623853,1992,6,22,2050,6666.7
6/23/92,285.2491479,1992,6,23,2100,7361.1
6/24/92,285.0493004,1992,6,24,2150,8055.6
6/25/92,285.1713143,1992,6,25,2200,8750
6/26/92,285.2256678,1992,6,26,2250,9444.4
6/27/92,285.3352588,1992,6,27,2300,10138.9
6/28/92,285.4150855,1992,6,28,2350,10833.3
6/29/92,285.3231479,1992,6,29,2400,11527.8
6/30/92,285.2752553,1992,6,30,2450,12222.2
7/1/92,285.3578619,1992,7,1,2500,12916.7
7/2/92,285.4255465,1992,7,2,2550,13611.1
7/3/92,285.4434737,1992,7,3,2600,14305.6
7/4/92,285.9328914,1992,7,4,2650,15000
7/5/92,285.9685482,1992,7,5,1200,2500
7/6/92,286.3495499,1992,7,6,600,1250
7/7/92,286.3265863,1992,7,7,0,0
7/8/92,286.2809919,1992,7,8,0,0
7/9/92,286.2802154,1992,7,9,0,0
7/10/92,286.4577232,1992,7,10,0,0
7/11/92,286.330153,1992,7,11,0,0
7/12/92,286.1138931,1992,7,12,0,0
7/13/92,286.0830993,1992,7,13,0,0
7/14/92,286.4603368,1992,7,14,0,0
7/15/92,286.5100179,1992,7,15,0,0
7/16/92,286.5251582,1992,7,16,0,0
7/17/92,286.6565066,1992,7,17,0,0
7/18/92,286.5556158,1992,7,18,0,0
7/19/92,286.5386556,1992,7,19,0,0
7/20/92,286.8197544,1992,7,20,2600,5000
7/21/92,286.9562189,1992,7,21,3455,7272.7
7/22/92,287.0232172,1992,7,22,4309,9545.5
7/23/92,286.972621,1992,7,23,5164,11818.2
7/24/92,286.9226626,1992,7,24,6018,14090.9
7/25/92,287.1773142,1992,7,25,6873,16363.6
7/26/92,287.1280144,1992,7,26,7727,18636.4
7/27/92,287.0703402,1992,7,27,8582,20909.1
7/28/92,287.1443714,1992,7,28,9436,23181.8
7/29/92,287.1884511,1992,7,29,10291,25454.5
7/30/92,287.1871236,1992,7,30,11145,27727.3
7/31/92,287.15077,1992,7,31,12000,30000
8/1/92,287.0961738,1992,8,1,10909,27272.7
8/2/92,287.0666591,1992,8,2,9818,24545.5
8/3/92,287.0875742,1992,8,3,8727,21818.2
8/4/92,287.0902397,1992,8,4,7636,19090.9
8/5/92,287.1416366,1992,8,5,6545,16363.6
8/6/92,287.093491,1992,8,6,5455,13636.4
8/7/92,287.2417544,1992,8,7,4364,10909.1
8/8/92,287.2196088,1992,8,8,3273,8181.8
8/9/92,287.1416643,1992,8,9,2182,5454.5
8/10/92,287.36764,1992,8,10,1091,2727.3
8/11/92,287.2820941,1992,8,11,0,0
8/12/92,287.3194182,1992,8,12,425,1875
8/13/92,287.3338549,1992,8,13,850,3750
8/14/92,287.3133385,1992,8,14,1275,5625
8/15/92,287.2868463,1992,8,15,1700,7500
8/16/92,287.4156435,1992,8,16,300,0
8/17/92,287.3550716,1992,8,17,233,0
8/18/92,287.1860386,1992,8,18,167,0
8/19/92,287.4003506,1992,8,19,100,0
8/20/92,287.4092969,1992,8,20,556,6875
8/21/92,287.5431998,1992,8,21,1013,13750
8/22/92,287.562569,1992,8,22,1469,20625
8/23/92,287.3595603,1992,8,23,1925,27500
8/24/92,287.333484,1992,8,24,2381,34375
8/25/92,287.2170161,1992,8,25,2838,41250
8/26/92,287.1187839,1992,8,26,3294,48125
8/27/92,287.0423679,1992,8,27,3750,55000
8/28/92,287.1299624,1992,8,28,300,0
8/29/92,287.1625274,1992,8,29,300,0
8/30/92,286.9801461,1992,8,30,273,0
8/31/92,286.983186,1992,8,31,245,0
9/1/92,286.9314737,1992,9,1,218,0
9/2/92,286.9226556,1992,9,2,191,0
9/3/92,286.8053905,1992,9,3,164,0
9/4/92,286.853082,1992,9,4,136,0
9/5/92,286.868101,1992,9,5,109,0
9/6/92,286.8573385,1992,9,6,82,0
9/7/92,286.6420906,1992,9,7,55,0
9/8/92,286.6160213,1992,9,8,27,0
9/9/92,286.6348636,1992,9,9,0,0
9/10/92,286.6149884,1992,9,10,1975,31250
9/11/92,286.5931686,1992,9,11,3950,62500
9/12/92,286.3205794,1992,9,12,3000,2500
9/13/92,286.2681323,1992,9,13,100,0
9/14/92,286.3203264,1992,9,14,250,384.6
9/15/92,286.3260179,1992,9,15,400,769.2
9/16/92,285.9378134,1992,9,16,550,1153.8
9/17/92,285.8463957,1992,9,17,700,1538.5
9/18/92,285.7494668,1992,9,18,850,1923.1
9/19/92,285.7225829,1992,9,19,1000,2307.7
9/20/92,286.282465,1992,9,20,1150,2692.3
9/21/92,286.2067874,1992,9,21,1300,3076.9
9/22/92,286.1580317,1992,9,22,1450,3461.5
9/23/92,286.2719139,1992,9,23,1600,3846.2
9/24/92,286.2251721,1992,9,24,1750,4230.8
9/25/92,286.3460213,1992,9,25,1900,4615.4
9/26/92,286.2973281,1992,9,26,2050,5000
9/27/92,286.1032934,1992,9,27,0,0
9/28/92,286.0879659,1992,9,28,2650,12500
9/29/92,286.1735257,1992,9,29,50,0
9/30/92,286.0140664,1992,9,30,1075,6250
10/1/92,286.2063506,1992,10,1,2100,12500
10/2/92,286.2375742,1992,10,2,1850,10500
10/3/92,286.1908983,1992,10,3,1600,8500
10/4/92,286.1034563,1992,10,4,1350,6500
10/5/92,286.0071028,1992,10,5,1100,4500
10/6/92,286.0205863,1992,10,6,850,2500
10/7/92,286.0242224,1992,10,7,1138,5000
10/8/92,286.0895083,1992,10,8,1425,7500
10/9/92,285.7799555,1992,10,9,1713,10000
10/10/92,285.7695811,1992,10,10,2000,12500
10/11/92,285.7541184,1992,10,11,2335,12115.4
10/12/92,285.7501565,1992,10,12,2669,11730.8
10/13/92,285.6655153,1992,10,13,3004,11346.2
10/14/92,285.6104858,1992,10,14,3338,10961.5
10/15/92,285.1637371,1992,10,15,3673,10576.9
10/16/92,285.1357094,1992,10,16,4008,10192.3
10/17/92,285.1039104,1992,10,17,4342,9807.7
10/18/92,285.1191409,1992,10,18,4677,9423.1
10/19/92,285.1061947,1992,10,19,5012,9038.5
10/20/92,284.7527111,1992,10,20,5346,8653.8
10/21/92,284.7047285,1992,10,21,5681,8269.2
10/22/92,284.6755881,1992,10,22,6015,7884.6
10/23/92,284.3582675,1992,10,23,6350,7500
10/24/92,284.3288117,1992,10,24,500,0
10/25/92,284.2539832,1992,10,25,300,0
10/26/92,284.1976124,1992,10,26,267,555.6
10/27/92,284.1858793,1992,10,27,233,1111.1
10/28/92,284.2619278,1992,10,28,200,1666.7
10/29/92,284.1565378,1992,10,29,167,2222.2
10/30/92,284.1178723,1992,10,30,133,2777.8
10/31/92,284.0903819,1992,10,31,100,3333.3
4/1/93,280.90468,1993,4,1,67,3888.9
4/2/93,280.9226142,1993,4,2,33,4444.4
4/3/93,280.9743057,1993,4,3,0,5000
4/4/93,280.7591064,1993,4,4,2000,27500
4/5/93,280.7472381,1993,4,5,300,0
4/6/93,280.9188395,1993,4,6,150,0
4/7/93,280.9333698,1993,4,7,0,0
4/8/93,280.9584686,1993,4,8,467,9166.7
4/9/93,280.9700457,1993,4,9,933,18333.3
4/10/93,281.135609,1993,4,10,1400,27500
4/11/93,281.1917857,1993,4,11,150,5000
4/12/93,281.1885171,1993,4,12,138,4615.4
4/13/93,280.9459799,1993,4,13,127,4230.8
4/14/93,280.9701982,1993,4,14,115,3846.2
4/15/93,280.9467563,1993,4,15,104,3461.5
4/16/93,280.9564166,1993,4,16,92,3076.9
4/17/93,280.9654461,1993,4,17,81,2692.3
4/18/93,280.9727494,1993,4,18,69,2307.7
4/19/93,280.9795466,1993,4,19,58,1923.1
4/20/93,281.4291272,1993,4,20,46,1538.5
4/21/93,281.5172381,1993,4,21,35,1153.8
4/22/93,281.451706,1993,4,22,23,769.2
4/23/93,281.7425483,1993,4,23,12,384.6
4/24/93,281.8190994,1993,4,24,0,0
4/25/93,281.8555188,1993,4,25,2300,2500
4/26/93,281.9063611,1993,4,26,1200,1250
4/27/93,282.0106627,1993,4,27,100,0
4/28/93,281.7284027,1993,4,28,2300,25000
4/29/93,281.7741566,1993,4,29,2013,22812.5
4/30/93,281.8807563,1993,4,30,1725,20625
5/1/93,281.9448464,1993,5,1,1438,18437.5
5/2/93,281.9833247,1993,5,2,1150,16250
5/3/93,281.9766315,1993,5,3,863,14062.5
5/4/93,281.9338862,1993,5,4,575,11875
5/5/93,282.2183472,1993,5,5,288,9687.5
5/6/93,282.3384928,1993,5,6,0,7500
5/7/93,282.5215812,1993,5,7,150,11250
5/8/93,282.3406072,1993,5,8,300,15000
5/9/93,282.7933212,1993,5,9,150,0
5/10/93,282.7929122,1993,5,10,558,0
5/11/93,282.6625379,1993,5,11,967,0
5/12/93,282.7695535,1993,5,12,1375,0
5/13/93,282.8751479,1993,5,13,1783,0
5/14/93,282.8179833,1993,5,14,2192,0
5/15/93,282.7811722,1993,5,15,2600,0
5/16/93,282.1657684,1993,5,16,1750,0
5/17/93,282.0693039,1993,5,17,1658,131.6
5/18/93,281.837654,1993,5,18,1566,263.2
5/19/93,282.2340873,1993,5,19,1474,394.7
5/20/93,282.3450821,1993,5,20,1382,526.3
5/21/93,282.3883819,1993,5,21,1289,657.9
5/22/93,282.4699833,1993,5,22,1197,789.5
5/23/93,282.5554634,1993,5,23,1105,921.1
5/24/93,282.570167,1993,5,24,1013,1052.6
5/25/93,282.5979244,1993,5,25,921,1184.2
5/26/93,282.4282675,1993,5,26,829,1315.8
5/27/93,282.3125344,1993,5,27,737,1447.4
5/28/93,282.2489192,1993,5,28,645,1578.9
5/29/93,282.0263022,1993,5,29,553,1710.5
5/30/93,282.3549504,1993,5,30,461,1842.1
5/31/93,282.6076575,1993,5,31,368,1973.7
6/1/93,282.6243126,1993,6,1,276,2105.3
6/2/93,282.6433143,1993,6,2,184,2236.8
6/3/93,282.6582918,1993,6,3,92,2368.4
6/4/93,282.8913108,1993,6,4,0,2500
6/5/93,282.9050925,1993,6,5,150,0
6/6/93,282.9431271,1993,6,6,317,0
6/7/93,282.9583542,1993,6,7,483,0
6/8/93,283.1221635,1993,6,8,650,0
6/9/93,284.0360595,1993,6,9,817,0
6/10/93,284.2335257,1993,6,10,983,0
6/11/93,284.0790716,1993,6,11,1150,0
6/12/93,284.2386626,1993,6,12,800,17500
6/13/93,284.3166176,1993,6,13,1050,16538.5
6/14/93,284.1571964,1993,6,14,1300,15576.9
6/15/93,284.166056,1993,6,15,1550,14615.4
6/16/93,284.1769642,1993,6,16,1800,13653.8
6/17/93,284.2124235,1993,6,17,2050,12692.3
6/18/93,284.4956817,1993,6,18,2300,11730.8
6/19/93,284.5457441,1993,6,19,2550,10769.2
6/20/93,284.7098238,1993,6,20,2800,9807.7
6/21/93,284.7225621,1993,6,21,3050,8846.2
6/22/93,284.6770404,1993,6,22,3300,7884.6
6/23/93,284.7916539,1993,6,23,3550,6923.1
6/24/93,284.8082051,1993,6,24,3800,5961.5
6/25/93,284.8166557,1993,6,25,4050,5000
